Title,Body,Stars
Ne puoi fare a meno fin quando non lo provi!,"  SPEDIZIONE Amazon sulle spedizione è una garanzia, meno di 24 ore per la consegna   IMBALLAGGIO E CONFEZIONE L echo dot è arrivato in una scatola Amazon di cartone assieme ad altri prodotti, protetto da un foglio accartocciato di carta riciclata La confezione è in cartone, di colore blu, sopra è raffigurato l echo dot, il marchio Amazon, il testo  echo dot  e per distinguerlo da quello di quarta generazione, in alto a destra un triangolino con stampigliato  5th generazione   Sul retro le diverse specifiche All interno della confezione oltre all echo dot, troviamo manualistica, una protezione in cartone, e alimentatore con cavo    RECENSIONE PRODOTTO L amazon echo risulta di buona fattura, si presenta di forma sferica con 4 tastini superiormente e un ingresso al posteriore dedicato all alimentazione Suddiviso in due parti, una in plastica che protegge l elettronica e la parte superiore in una sorta di retina dove è presente l altoparlante da 1,7 pollici Di seguito alcune specifiche Dimensioni  100 x 100 x 89 mmAltoparlanti  Altoparlante da 1,7   44 mm  a diffusione anterioreFormati audio supportati  Audio ad alta definizione, senza perditeMicrofono   IntegratoSensore di temperatura  SiPeso  340 grammiAudio  Altoparlante da 1,73   44 mm  a diffusione anterioreUscita audio   NoConnettività Wi Fi  Il Wi Fi dual band è compatibile con reti 802 11 a b g n ac da 2,4 e 5 GHz  Non compatibile con reti Wi Fi ad hoc  o peer to peer  Protocolli per Casa Intelligente Wi Fi, Bluetooth Low Energy MeshConnettività Bluetooth  Compatibile con Advanced Audio Distribution Profile  A2DP  per lo streaming di contenuti audio dal tuo dispositivo mobile a Echo Dot o da Echo Dot a un altoparlante Bluetooth  Audio Video Remote Control Profile  AVRCP  per controllare i dispositivi mobili connessi tramite comando vocale Requisiti di sistema  Puoi connettere Echo Dot immediatamente al Wi Fi tramite l App AlexaDisponibile in diverse colorazioni io ho scelto la più classica antracite, elegante con il suo anello RGB posto sul fondo si adatta ad ogni stile ed arredamento  L unica pecca è data dall alimentatore che assieme al cavo è di colore bianco La configurazione è avvenuta in un lampo tramite l app Alexa di Amazon installata sullo smartphone  Il wifi è stato subito riconosciuto e in pochi e semplici passi Alexa ha preso vita Le funzioni da utilizzare sono svariate, dal comandare una semplice lampadina o presa intelligente, a gestire autonomamente una routine, ovvero una serie di azioni La compatibilità con altri accessori, anche di diverse marche, è immediata questo grazie alle skills, una sorta di app di diversi fornitori da installare all interno dell echo dot Personalmente ho collegato ad  Alexa  qualche luce wifi, delle prese smart, una TV e videocamere di sorveglianza  Tutto gestito nel migliore dei modi Per attivarla basta pronunciare Alexa e l azione da farle eseguire  Il microfono è ottimo riesce a comprenderlo sempre o quasi, inoltre riconosce i comandi detti a voce bassa e ti risponde di conseguenza, utile di notte per evitare di fare rumore Altra funzione interessante è data dalle routine, ovvero impostare una serie di azioni che Alexa tramite l echo dot può svolgere autonomamente, partendo da un input come una frase, un rilevamento da un sensore, un suono o una presenza Ad esempio ho impostato che la mattina in una precisa fascia oraria, al rilevamento di una persona nella stanza, si scendano le luci, Alexa dia il buongiorno, notizie meteo e news del giorno  Comodo, per impostare le routine anche il sensore di temperatura interno, che ad esempio può comandare il riscaldamento etc   Sicuramente il sensore di presenza e di temperatura sono le chicche più importanti per questo nuovo echo dot Oltre il domotizzare casa l eco dot ci da la possibiltà di avere vere e proprie interazioni con Alexa, può raccontare una storia, una barzelletta, fare un gioco etc, inoltre è possibile ascoltare la radio, una canzone, chiamate, insomma l unica vera limitazione è la nostra fantasia Dal punto di vista tecnico, l audio è spettacolare per essere così piccolo gli ingegneri che l hanno progettato hanno fatto un buon lavoro, i bassi sono corposi e il suono definito, il microfono, come detto in precedenza è di ottima qualità   CONCLUSIONE Io ero scettico, indeciso sull acquisto, probabilmente se non l avessi preso, non sarebbe cambiato nulla e avrei potuto farne a meno ancora per molto, ma ormai è pane quotidiano, impostare una sveglia, un promemoria, un timer, scrivere la lista della spesa, seguire una ricetta è diventato tutto più facile Consiglio l acquisto  Si e no, ovvero, dipende dall utilità che può avere soggettivamente Tecnicamente lo consiglio in modo spassionato, un gingillo tech di ottima fattura e bella presenza Note dolenti come scritto precedentemente il filo e l alimentatore bianco rispetto al dot nero, e la mancanza di una uscita jack audio Il prezzo giusto  25 30  a queste cifre è un affare ","5,0"
"Qualità audio ottima, ma attenzione a disattivare la modalità la rilevazione ad ultrasuoni.","L Echo Dot è un dispositivo interessante, ma ha alti e bassi Iniziamo con il lato positivo  l audio dell Echo Dot è davvero sorprendente  Nonostante le dimensioni compatte, riesce a produrre un suono chiaro e potente  Sia che tu voglia ascoltare musica, podcast o semplicemente chiedere informazioni, l Echo Dot offre una buona esperienza sonora Purtroppo, il riconoscimento vocale non è sempre all altezza  A volte Alexa fatica a capire i comandi, interpretandoli in modo errato o ignorandoli completamente  Questo può essere frustrante, soprattutto quando si desidera un esperienza fluida e senza intoppi  Spero che in futuro vengano apportati miglioramenti a questo aspetto L integrazione degli ultrasuoni, promossa come una funzione innovativa dell Echo Dot, si è rivelata un flop La capacità di rilevare la presenza attraverso gli ultrasuoni sembrava promettente, ma purtroppo ha causato problemi all audio  Dopo aver utilizzato questa funzione, ho notato una netta diminuzione della qualità del suono  Il volume è diventato debole e il suono distorto  Questo è un grande punto negativo  Ho dovuto disabilitarla","4,0"
La domotica alla portata di tutti,"  SPEDIZIONE Rapidissima come da tradizione Amazon  echo arrivato in un giorno    RECENSIONE PRODOTTO L amazon echo risulta di buona fattura, si presenta di forma sferica con 4 tastini superiormente e un ingresso al posteriore dedicato all alimentazione Suddiviso in due parti, una in plastica che protegge l elettronica e la parte superiore in una sorta di retina dove è presente l altoparlante da 1,7 pollici Di seguito alcune specifiche Dimensioni  100 x 100 x 89 mmAltoparlanti  Altoparlante da 1,7   44 mm  a diffusione anterioreFormati audio supportati  Audio ad alta definizione, senza perditeMicrofono  IntegratoSensore di temperatura  SiPeso  340 grammiAudio  Altoparlante da 1,73   44 mm  a diffusione anterioreUscita audio  NoConnettività Wi Fi  Il Wi Fi dual band è compatibile con reti 802 11 a b g n ac da 2,4 e 5 GHz  Non compatibile con reti Wi Fi ad hoc  o peer to peer  Protocolli per Casa Intelligente Wi Fi, Bluetooth Low Energy MeshConnettività Bluetooth  Compatibile con Advanced Audio Distribution Profile  A2DP  per lo streaming di contenuti audio dal tuo dispositivo mobile a Echo Dot o da Echo Dot a un altoparlante Bluetooth  Audio Video Remote Control Profile  AVRCP  per controllare i dispositivi mobili connessi tramite comando vocale Disponibile in diverse colorazioni io ho scelto la più classica antracite, elegante con il suo anello RGB posto sul fondo si adatta ad ogni stile ed arredamento  L unica pecca è data dall alimentatore che assieme al cavo è di colore bianco La configurazione è avvenuta in un lampo tramite l app Alexa di Amazon installata sullo smartphone  Il wifi è stato subito riconosciuto e in pochi e semplici passi Alexa ha preso vita Le funzioni da utilizzare sono svariate, dal comandare una semplice lampadina o presa intelligente, a gestire autonomamente una routine, ovvero una serie di azioni La compatibilità con altri accessori, anche di diverse marche, è immediata grazie alle skills installabili Personalmente ho collegato ad  Alexa  qualche luce wifi, delle prese smart, una TV e videocamere di sorveglianza  Tutto gestito nel migliore dei modi Per attivarla basta pronunciare Alexa e l azione da farle eseguire  Il microfono è ottimo riesce a comprenderlo sempre o quasi, inoltre riconosce i comandi detti a voce bassa e ti risponde di conseguenza, utile di notte per evitare di fare rumore Altra funzione interessante è data dalle routine, ovvero impostare una serie di azioni che Alexa tramite l echo dot può svolgere autonomamente, partendo da un input come una frase, un rilevamento da un sensore, un suono o una presenza Sicuramente il sensore di presenza e di temperatura sono le chicche più importanti per questo nuovo echo dot Oltre il domotizzare casa l eco dot ci da la possibiltà di avere vere e proprie interazioni con Alexa, può raccontare una storia, una barzelletta, fare un gioco etc, inoltre è possibile ascoltare la radio, una canzone, chiamate, insomma l unica vera limitazione è la nostra fantasia   CONCLUSIONE Con soli 25 30 euro è possibile dotarsi di un hub con cui integrare moltissime skill domotiche Consiglio l acquisto  Si, ottimo upgrade per chi ha già alcuni dispositivi integrabili  lampade, termostato, prese smart  ","5,0"
Echo Dot 5: Un assistente virtuale di qualità superiore,"Ho acquistato l Echo Dot 5 e devo dire che sono rimasto completamente soddisfatto delle sue prestazioni  La qualità del suono è sorprendente per un dispositivo di dimensioni così compatte, con bassi profondi e acuti cristallini che riempiono l ambiente  L assistente virtuale Alexa è estremamente reattivo e intuitivo, rispondendo prontamente a tutte le mie richieste  Inoltre, la connettività con altri dispositivi smart nella mia casa è stata senza problemi, consentendomi di controllare luci e molto altro ancora con semplici comandi vocali  L Echo Dot 5 si è dimostrato un alleato versatile e affidabile nella mia routine quotidiana  Lo consiglio vivamente a chiunque sia alla ricerca di un assistente virtuale di qualità superiore ","5,0"
"Buona, ma non perfetta","Rispetto al precedente Dot è più forte come suono, ma è molto più direzionale e il dialogo a volte si fatica a comprendere  anche perché l eq vale solo per la musica, non Alexa in se , sarebbe carina una modalità per far livellare in automatico il volume in base all ambiente circostante Le aggiunte di sensore a ultrasuoni e di temperature sono molto buone ","4,0"
Mi ha conquistato!,"L ho acquistato così, un po  per curiosità  Ma sono rimasto conquistato dalla profondità e purezza del suono  Incredibile come un diffusore così piccolo possa essere non solo potente, ma fedele nella riproduzione senza distorcere a qualsiasi volume  Applausi a scena aperta  brava Alexa ","5,0"
Chi non lo conosce?,"Il piccolo assistente vocale di Alexa  Bello ed elegante  Il suono, nonostante le dimensioni, è chiaro e potente  La risposta alle richieste è immediata  L ho preso durante una delle tante promozioni e credo che alla prossima ne prenderò un altro, anche perché vorrei provare a collegarlo alla tv smart per realizzare una specie di impianto stereo wireless Consigliato ","5,0"
Bello ma ho fatto il reso,Lo avevo preso per rispondere al citofono con ring intercom   Ogni volta per aprire il cancelo dovevo dire un pin vocale   una menata    Ho fatto il reso,"4,0"
Dipendenza,Non ti rendi conto della sua utilità fin quando non lo compri  Non riesci a farne più a mano  Sembra una persona in più in casa  Acquisto più che ottimo,"5,0"
Presenza discreta.,Da quando è arrivata a casa nostra ha subito preso il suo posto in cucina  Viene spesso consultata da tutti noi     Speriamo duri nel tempo      ,"5,0"
Piccolo ma potente,"Dispositivo preso in accoppiata ad una lampadina Smart, semplice nell installazione e veramente comodo nell uso quotidiano  Non ha nulla da invidiare al  fratello più grande  in termini di audio  la sveglia mattutina si fa sentire forte e chiaro  Da prendere se si vuole rendere la casa un po  più Smart ","5,0"
Ottimo,Come le attese ,"4,0"
Utile,È bello averlo in casaÈ bello averlo in casa,"5,0"
Ottima!,Dispositivo dal design carino e dalle ottime proprietà   Consigliato ,"5,0"
Ottimo assistente virtuale,"È un ottimo assistente virtuale, gli puoi chiedere di tutto senza distogliere le mani dalle attività che stai svolgendo, puoi telefonare agli altri utenti alexa, puoi chiedere calcoli ecc ecc      Qualsiasi cosa","5,0"
"Echo Dot (5ª generazione, modello 2022)","amazon echo dot 5 molto migliorato sia nella qualità del suono, sia come prestazioni  il migliore fino ad ora ","5,0"
Ottimo affare,"Acquistato in sconto insieme a Ring Intercom  Avevo già un echo dot di generazione precedente e conoscevo già i pregi del prodotto  Questo migliora la qualità audio, in più ha un sensore di temperatura e può essere utilizzato come sensore di presenza  Consiglio l acquisto","5,0"
OTTIMO,"COMPRATO UN PO  PER GIOCO, DEVO DIRE CHE HA UN OTTIMO SUONO, LA MUSICA SI SENTE BENISSIMO  UN OTTIMO APPARECCHIO ","5,0"
Ottima qualità,"Buon suono, una cassa veramente economica e buonissima ","5,0"
Ottimo,"Prodotto eccellente, facile da configurare, il pacco ha rispettato i tempi","5,0"
Mai più senza.,"Ormai vivo ascoltando la musica solo con Alexa    comoda e utile per molte altre cose    timer, sveglia ecc   ","5,0"
Bello davvero,Che dire   Già il prodotto si conosce  Per me molto utile e lo trovo bello esteticamente ,"5,0"
articolo buono ma,articolo di buone caratteristiche tecniche ma utile solo per particolari utenti e tutto sommato superfluo,"4,0"
Davvero utile!,"Pensavo di trovare più difficoltà invece è programmato per rendere tutto più semplice e veloce anche nelle impostazioni, nei collegamenti ecc Ottima potenza  Bel Designs","5,0"
"Alexa, una garanzia!","Ottimo prodotto, utile anche la funzione orologio ","5,0"
Comoda in casa.,"Che dire, ormai se non ce l hai la devi comprare ","5,0"
"Mi trovo bene, se lo programmi come si deve fa quello che chiedi","Già scritto nel titolo, c è poco da dire di Alexa","5,0"
Consigliato!,Ha molteplici funzioni è sempre più avanzate per una casa intelligente  Migliorata nei comandi è un ottimo supporto per svolgere la propria routine giornaliera con semplicità ,"5,0"
Buon prodotto,Audio un po cupo,"4,0"
Alex,Sonno soddisfatta del mio acquisto,"5,0"
Felice,Ho regalato questo dispositivo ai miei genitori  Sono rimasti soddisfatti per la facilità di installazione e per la qualità audio,"5,0"
È un regalo,L ho scelto come regalo  Per ora era felice    Poi vediamo come sarà dopo l installazione  Ma Alexa dovrebbe essere una garanzia   ,"5,0"
Ottimo prodotto,"Comodo, si accende subito  E si collega sia ad internet che al cellulare istantaneamente  Facilissimo da usare","5,0"
Ottimo e funzionale prodotto a prezzo buono.,"Tutto ok, non c è nulla che non va, qualche problemino sulle impostazioni, ma niente di che ","5,0"
Un affare se in offerta,"Ottimo suono, a prezzo pieno è costoso, ma in offerta è un acquisto consigliato","5,0"
AIUTA TANTISSIMO NELLA QUOTIDIANITÀ,SEMPLICEMENTE INCREDIBILE,"5,0"
Alexa,È diventata la mia aiutante in casa  lista spesa  appunti  timer  sveglia musica  ecc  non potrò più farne a meno   ,"5,0"
Alexa,Prodotto unico,"5,0"
Ottimo,Soddisfatto,"5,0"
Tutto ok,Tutto ok,"5,0"
Alexa,Alexa e fenomenale ottima,"5,0"
Audio perfetto,"Avevo il modello precedente, questo qui naturalmente è ancora meglio","5,0"
Utile,Buon promemoria per spese sveglie e compleanni,"5,0"
prodotto come da descrizione,niente da dire     spedizione prime superveloce,"4,0"
Alexa,Facile da usare lo uso tanto per la musica e soprattutto per chiedere tante cose e sapere notizie veloci,"4,0"
Echo dot 5 senza orologio,"Il prodotto è ottimo, facile installazione, risponde bene ai comandi, ottimo suono, unica nota negativa  e per questo non ho dato 5 stelle  il cavo di alimentazione è bianco ma con un echo dot nero antracite , se io lo volevo nero era per un motivo quindi anche il cavo doveva essere nero, stesso problema con echo show 5, sinceramente non ho capito questa filosofia, peccato sarebbe stato perfetto","4,0"
Funziona davvero bene,"Lo uso per gestire Tv android Sony, riscaldamento Finder Bliss, robot Deboot ed infuturo per le lampadine  Sono pienamente soddisfatto anche perché avevo l assistente Google e trovo che Alexa ha una marcia in più, per esempio ti da la buonanotte con un bacino sonoro parlandoti a bassa voce    la prima volta ho avuto i brividi dalla gioia ","5,0"
Ottimo,"Molto bello, è arrivato il giorno dopo dell ordine in ottime condizioni Ho avuto qualche difficoltà nel configurarlo  Comunque funziona bene","4,0"
Ottimo,"È il secondo che acquisto ed è davvero comodissimo, soprattutto abbinato alle smart plugs Le caratteristiche sono spiegate ottimamente quindi non sto a ripeterleConsigliato","5,0"
Un apparecchio che ti tiene compagnia,"Ottimo prodotto, i miei nipoti lo usano spesso","5,0"
Una netta differenza rispetto alle generazioni precedenti,"Lo ho comprato per sostituire il primo Echo Dot che avevo acquistato, che cominciava a non funzionare più tanto bene  Non mi aspettavo una qualità del suono così diversa, si sente che l altoparlante è di un livello superiore  Penso che pian piano li sostituirò tutti","5,0"
Qualità garantita Amazon,Il prodotto ha tutte le funzionalità per cui è noto ed esegue in modo eccellente il suo compito La qualità audio è più che soddisfacente e il design è accattivante L installazione è molto semplice anche per gli utenti più inesperti Grazie per aver letto la mia recensione ,"5,0"
Da avere,Non ne faccio più a meno,"5,0"
Un'ottima  cassa audio,"Non avendo il wifi a casa e collegando i dispositivi tramite hotspot del mio telefono, è stato abbastanza difficile configurare la cassa la prima volta per funzionare solo tramite bluetooth  Ma una volta configurata funziona come un orologio Casio, perfettamente e senza intoppi  La qualità del suono a questo prezzo credo che sia imbattibile, il microfono e il software riconoscono benissimo la voce ed è un gran piacere usarla per ascoltare musica e guardare film  Ve la consiglio ","5,0"
Compagnia,Semplicità nel suo uso e versalita ,"5,0"
"Buono, ottimi i materiali","Ottimo strumento, molto utile","5,0"
"Funziona benissimo , non posso farne a meno","Alexa è insostituibile  Mi trovo benissimo, qualità suono ottima , veloce nella ricerca , facile da configurare  ","5,0"
ONNISCIENTE,"Ottimo prodotto di facile installazione, risponde a qualsiasi domanda ed ha un infinità di applicazioni che io, per manifesta incapacità, ancora non utilizzo,ma piano piano         ","5,0"
Top!,"Amazon echo   Personalmente è il primo dispositivo  che acquisto e devo dire che sono molto soddisfatto, indispensabile per chi ama la domotica in  casa e vuole dare un tocco di tecnologia in più ","4,0"
Bella,Un po  difficile da configurare ma bella,"5,0"
Buono,Molto migliorato rispetto ai precedenti,"4,0"
ARTICOLO FUNZIONALE E BUONISSIMO,ARTICOLO COMODO E FUNZIONALE LO CONSIGLIO,"5,0"
May/Consegna,Materiale come ordine  Forniture consigliato ,"5,0"
ottimo,GRAZIE AMAZON PRODOTTO OTTIMO SONORITA OTTIMA,"5,0"
Un avventura andata a finire per fortuna BENISSIMO,"Inizialmente ero moltoSoddisfatto ma dopo un mese di utilizzo la cassa ha iniziato a  friggere  rendendo i bassi fastidiosi, il suono era tremolante  L assistenza ha provato a farmi riavviare echodot, ma il problema è rimasto  Dopo un passaggio all assistenza specifica e parecchi tentativi hanno scelto di darmi in sostituzione un oggetto ricondizionato  Che dopo un mese di utilizzo ha lo stesso problema  A oggi mi è stato cambiato in tempi brevissimi  L assistenza come sempre è imbattibile   MI HANNO SUPPORTATO DURANTE TUTTA LA PROCEDURA SOSTITUENDOLO,Ora va tutto bene  Ps Gli altri due che ho acquistato per la casa non hanno quel problema per fortuna ","5,0"
Utilità,Straordinario   ,"5,0"
Ottimo ma...,All inizio avevo messo 5 stelle  Ora ce l ho da qualche mese e abbasso a 4 perché ultimamente il comando vocale non funziona sempre benissimo e a volte si scollega dal wifi nonostante la connessione funzioni perfettamente ,"4,0"
PRODOTTO INDISPENSABILE,"Avevo un Echo Dot di di quarta generazione che ha smesso di funzionare dopo un anno  Volevo chiedere ad Amazon se si poteva riparare, ma alla fine ho comprato subito questo modello, sperando che duri di più  Una volta abituati ad Alexa, non se ne può più fare a meno ","5,0"
Ottimo,"Si sente benissimo, è piccolo e si adatta ad ogni stanza  Peccato il filo bianco nonostante echodot che ho ordinato io sia nero","4,0"
Amazon,Ottima come tutti prodotti amazon secondo me é da migliore il touch per mettere pausa perché non prende al primo colpo,"5,0"
Tutto bene,Tutto bene,"5,0"
Vale la pena??,"Sono passato dalla terza alla quinta generazione e questo è quello che ho riscontrato    AUDIO    A livello audio c è stato un netto miglioramento, il suono è più pulito e più corposo, ora si può godere meglio di una buona musica      FUNZIONALITÀ       Le funzionalità mi sembrano tutto sommato le stesse, è stato aggiunto un sensore di temperatura, anche se non mi sembra precisissimo e un sensore di prossimità per rilevare se c è qualcuno nella stanza   DESIGN   Il design è molto bello e ben curato, preferisco questo modello fatto a sfera che quello della terza generazione schiacciato Si adatta perfettamente in ogni stanza ed oltre ad essere funzionale fa anche da arredo        CONFIGURAZIONE       La configurazione è immediata se lo acquistate con l opzione di associarlo direttamente al vostro profilo, una volta tirato fuori dalla scatola basta attaccare l Echo alla corrente e si attaccherà automaticamente al WiFi e farà da solo tutte le configurazioni Se invece è il vostro primo Echo basta seguire le istruzioni e in pochi semplici passaggi verrete guidati nella configurazione    CONSIDERAZIONI   Vale la pena passare da un precedente modello a questo  Io dico dipende, i precedenti modelli non sono così inferiori o non gli mancano funzionalità essenziali da essere sostituiti con questo a priori Tuttavia questo prodotto si trova spesso in sconto a circa 20 euro e per questa cifra mi sento di consigliare il passaggio, altrimenti a prezzo pieno l unica cosa evidente per la quale varrebbe la pena effettuare l upgrade a mio avviso è l audio migliorato Consiglio quindi se volete acquistarlo di aspettare una delle tante promo e portarvelo a casa con poco più di 20 euro ","4,0"
Alexa,Ottimo,"4,0"
Alexa gen 5 ottimo come gli altri Alexa,"Ho perso il conto di quanti Echo dot ho comprato, tutti validissimi ","5,0"
Spettacolo,"Eco Alexa 5 generazione, ha una qualità del suono bellissima  Ottima ","5,0"
Ottimo,"Ordinato per un regalo di compleanno ad una carissima amica  Ne avevo già sentito parlare bene dell echo dot ed è vero  È utile e indispensabile da avere in casa  Con echo dot puoi fare tutto  ascoltare musica, chiedere ad Alexa l ora, il tempo e  di impostare timer o sveglie  Sta bene su tutti gli stili di arredamento  Consigliatissimo ","5,0"
Ottimo,Ottimo prezzo come sempre Amazon è il top degli acquisti,"5,0"
Comodo,usata come regalo,"5,0"
Ottimo,Ottimo,"5,0"
Top,"Mi diverto con Alexa, applausi per chi lo ha inventato ","5,0"
Alexa,Beh fa quello che deve fare  La musica si sente bene,"4,0"
Per me indispensabile!!,"Un dispositivo per ogni stanza e non solo, infatti anche in giardino c è  Alexa   Il motivo è semplice, domotica, musica, ricerche, notizie, ricette e quant altro ","5,0"
ottimo,"non era per me ma per un non vedente ho aspettato che lo usasse un po  prima di lasciare feedback, ottimo prodotto veramente soddisfatto dell acquisto ","5,0"
Ottimo prodotto,I Dot sono sempre un ottimo entry level  Non sempre recepisce le domande al primo tentativo ma tutto sommato bene  Ottimo audio,"5,0"
Molto funzionale...,"Non avevo mai provato un oggetto simile, l ho trovato divertente e utile  Ci sono diversi giochi che intrattengono i bambini e si possono caricare moltissime skills per comandare i comandi domotici di casa  Valuterò l acquisto di un altra Alexa","5,0"
Buono,Como per sapere notizie in tempo reale,"4,0"
Recensione Alexa,Mi è piaciuto il servizio che offre,"5,0"
Ottimo prodotto,Non credo abbia bisogno di descrizioni Alexa ,"5,0"
Qualità del suono veramente buona,"La scorsa estate, durante una super offerta a soli 20  , avevo preso l Echo Dot 4 generazione ed ero rimasto piacevolmente stupito della qualità sonora in considerazione delle sue ridotte dimensioni  tralascio le considerazioni sul mondo Alexa di cui molti ed assai più competenti di me già hanno scritto   A novembre u s  vedo una super offerta a 25   per il nuovo modello di 5  generazione con recensioni molto positive circa un ulteriore ed apprezzabile miglioramento del suono   Decido che per quella cifra, visto che a volte si sprecano ben più soldi per poco più di nulla, valeva la pena di acquistarlo così li avrei sistemati in ambienti diversi  Se la 4  generazione era già buona questo mi stupisce nel confronto  A volte mi chiedo come sia possibile che un aggeggio poco più grande di una mela possa avere una tale qualità sonora  Chiaramente la soundbar che ho è un altra cosa, ma parliamo di ben altre dimensioni e prezzi ","5,0"
Echo Dot 5gen,"Prodotto arrivato in tempo con spedizione Prime, conforme alla descrizione e alle foto presenti sul sito","5,0"
.,BUON PRODOTTO,"5,0"
Bella comoda,Bella comoda,"4,0"
Consigliato,Facile installazione lo trovo utile  Consigliato per il prezzo,"5,0"
