Title,Body,Stars
Utilissima ed apprezzata come regalo,"Prodotto comprato in occasione di Natale ed è stato molto apprezzato Echo Dot 5 ha una bella linea che si rapporta in maniera ottimale con l ambiente circostante L audio durante la riproduzione della musica è limpido e si riescono a percepire i bassi in modo equilibrato Comodissimo anche il termostato integrato che rileva  la temperatura interna alla stanza Da sottolineare anche l ottima interfaccia del sistema che lo rende migliore dei competitors Prodotto consigliato sia agli amanti della tecnologia che vogliono rendere la loro casa dotata di una domotica intelligente, sia a chi vuole semplicemente un assistente virtuale ","5,0"
Alexa tutta la vita,Ottimo acquisto,"5,0"
Ottimo,Funziona benissimo,"5,0"
È già il secondo,Acquistato per avere la musica multi stanza  Ho provato a metterlo come audio stereo per il televisore ed è stata veramente una scoperta i due canali restituiscono un audio potente per piccoli ambienti,"5,0"
Alexsa e molto utile,"E un regalo che io ho fatto per natale,funziona bene il pacchetto ben fatto,e arrivato il giorno dopo con prime","5,0"
Suona molto bene,"Perfetto  Buona qualità del sound, ma devo ancora scoprire come collegare tramite il Bluetooth, la mia smart TV     sempre che sia possibile farlo, però acquistato a metà prezzo con il Black Friday, un bell affare    cinque stelle ","5,0"
molto professionale,forteeeeeeee,"5,0"
Divertente,Ottima compagnia e molto utile per ogni curiosità  Sostituisce anche il classico stereo ,"5,0"
Ottimo,Ottimo prodotto,"5,0"
Un buon prodotto per la sua fascia di prezzo,La qualità dell audio non è male ma si potrebbe fare di meglio  La regolazione del volume tramite i tasti a volte ha una risposta non immediata  Ma è piccolo e pratico da spostare  Noi lo usiamo in sala e in giardino principalmente per ascoltare musica e portarlo avanti e indietro è pratico  Purtroppo va necessariamente collegato alla corrente e non dispone di autonomia,"4,0"
Utile!,"Posizionato in cucina, utile per sveglie timer e promemoria, musica e radio con semplice richiesta vocale, arricchito con tanti giochi da poter fare  Da migliorare in futuro l intelligenza di Alexa e aggiungerei anche una cassa più forte   ","4,0"
Ottimo suono rispetto all'echo dot base,"Sono contento che abbiano migliorato il microfono, adesso anche a due stanze di distanza riesce ad ascoltare  Inoltre mi è capitato di parlare nominando  Alexa  in un discorso con altre persone e non si è attivata  Forse un aggiornamento fa riconoscere finalmente quando è il momento di attivarsi e quando no  Comunque funziona in modo egregio con tutte le funzioni di Alexa ","4,0"
Ottimo per tante cose musica news comandi vocali ecc.top,"Ottima qualità del suono,riconoscimento vocale ok puoi chiedergli quasi tutto ","5,0"
Soddisfatto. Buon prodotto.,"Prodotto che oramai si recensisce da solo, essendo della famiglia  Alexa   A livello di audio mi sembra appena poco più basso dei un echo dot, ma sicuramente resta un ottimo prodotto  Avrei messo i comandi touch più verso l utente e meno verso il lato nel quale si inserisce l alimentazione","4,0"
Ottimo sound,"Buona integrazione con la voce e ottimo sound, scontato è un affarone  ","4,0"
Bello,Troppo carino x ascoltare musica e chiedere informazioni s3nza usare il tel   ottimo,"4,0"
Echo ed Alexa al TOP,Nella vostra camera da letto non può mancare questo accessorio Essenziale per la domotica ,"4,0"
Ci vuole prime music,Per essere così piccolo si sente benissimo,"5,0"
Buono,Mi aspettavo un audio migliore ma va bene così  È  un buon prodotto ,"4,0"
Echo che echo,"Funziona veramente      Umor, sono capricci utili soprattutto per i bambini, non mi voglio prolungare più di tanto l importante avere tutto WiFi poi con Echo puoi fare quello che vuoi,facile nel montaggio, installazione idem, consiglio vivamente amazon se consiglia ci sarà un motivo ","5,0"
Un'assistente vocale ma non solo,"Ho acquistato Alexa come regalo di Natale per mia madre perchè ama molto ascoltare musica e perchè vedo che spesso guarda le ricette su youtube, quindi per permetterle di azionare musica o tv senza dover usare un telecomando  In realtà ho scoperto tutte le funzioni legate alla casa intelligente come l accensione di luci o il collegamento di dispositivi, e mi sto appassionando  Credo che nel tempo implementerò ulteriormente quest automazione domestica con Alexa ","5,0"
Da consigliare,Prodotto molto semplice da usare,"5,0"
Casa,Mi è piaciuto tantissimo e un  altoparlante ottimo  di alta qualità  lo consiglio  lo utilizzo  per comandare  tutto la casa  ,"5,0"
ottimo prodotto,prodotto ottimo come da descrizione,"5,0"
Utile,"Ottimo suono , utile","4,0"
Bello,"Alexa è stratosferica  Risponde bene ad ogni comando, molto comodo e utile per chi sta sempre a letto e per chi perde il telecomando","5,0"
Ottima,Tutto bene si sente ottimamente fa tante cose è intuitiva e cosa importante si collega anche con l hotspot dello smartphone ,"5,0"
Alexa,Alexa una garanzia,"5,0"
Fantastica,"Alexa meravigliosa,mi ricorda appuntamenti,mi fa lista della spesa mi dà il buongiorno, qualità della musica molto buona","5,0"
ottimo,da scoprire le funzionalità del dispositivo,"4,0"
Ottimo,Bella e funzionale,"5,0"
Ottimo passatempo,Facile l istallazione e comoda,"5,0"
Un cult,Sempre utile,"5,0"
"Buon sound, temperature rilevata imprecisa","Un discreto passo avanti dal 4, anche se niente di esoterico  L avevo preso più che altro per sfruttare anche il sensore di temperatura, ma è decismente inaffidabile  Anche due echo 5 vicini segnano 2 gradi di differenza    mica pochi UDPATE I sensori dei due echo ora sono in linea sia tra loro che col termostato di casa","4,0"
Bellissimo...lo consiglio grazie,"Allora amici che dire di Echo Dot 5 non mi aspettavo che questo oggetto trasformasse la mia vita Ho iniziato , con un pezzo Alexa appunto e ho trasformato a oggi la mia casa tutta smart, dalla tv a tutti gli oggetti smart che ci sono su Amazon Diriggo il tutto semplicemente seduto sul divano oppure in cucina fantastico lo consiglio Ps l unica cosa che non va e  chiedere a Alexa di svegliarmi tre volte la settimana per andare ha correre alle 7 del mattino  perche  e troppo precisa e se non ti svegli insiste ha chiamarti ahahaha ","5,0"
Regalo perfetto,"Ne ho prese tre in breve periodo, regalate e tutti soddisfatti ","5,0"
Ottimo prodotto,Ottimo prodotto,"4,0"
Alexa,Buon prodotto,"4,0"
Bello esteticamente e funzionale. Nel complesso un buon prodotto,"Ormai gli echo dot non sono più una novità  Ottimo prodotto come gli altri delle precedenti generazioni del resto  Ne ho altri 4, anche di prima generazione  In questo mi aspettavo qualche miglioria evidente ed invece, più o meno, siamo sul solito livello anche come qualità audio ","4,0"
Semplice e molto utile,"Gli chiedi di tutto, dalle notizie alle curiosità,  persino le barzellette  Si collega con tutte le radio del mondo, utile per le lingue, utile per la scuola dei ragazzi e per cultura generale  Un accesso vocale alla rete  Simpatica la funzione di messaggi preimpostati a certe ore, ad esempio per ricordarti di una medicina o di fare sport o di bere più spesso  Si può adattare come un amico che ti ricorda le cose importanti   Trovo che sia un bel oggetto anche per persone anziane sole  Ottimo rapporto qualità prezzo ","5,0"
Funzionale,Un po tanti difetti ,"4,0"
Amico indispensabile,"Rapida installazione, mille risorse per tutta la famiglia","5,0"
Audio più potente e nuovi sensori,"                    Impossibile caricare il contenuto multimediale                  Il progresso continua , in primis spicca la presenza di un sensore temperatura che rende questo dispositivo un preciso  termometro , altra integrazione riguarda l accelerometro così vi basterà toccare il dispositivo per ad esempio mettere in pausa o stoppare la svegliaDriver più grande e la differenza si notaAudio abbastanza potente e soprattutto realmente personalizzabile nell equalizzazione, modificando dall app le frequenze andrete realmente a percepire le differenze , suono corposo e abbastanza potenteFunzione di risparmio energetico , anche la scheda per la connessione wi fi è di ultima generazione consentendo un maggior risparmio energeticoConnettività Bluetooth da e verso altri dispositivo stabile che vi permetterà di connettere il dispositivo ad altre periferiche mandando o ricevendo l audio, è stato rimosso l uscita jack via cavoInstallazione immediata se scegliete l autoconfigurazione in fase d acquisto o anche altrettanto rapida se configurerete tramite app vi basterà sincronizzare e inserire la vostra password wi fiMicrofoni bidirezionali sensibili , daranno la possibilità di azionare comandi di qualsiasi genere dalle ricerche web a l azionamenti di elettrodomestici presenti in casa e associabili all account, ormai quasi tutti gli elettrodomestici dalle tv alle lavatrici o aspirapolveri di ultima generazione sono associabili a questo dispositivoForma e design gradevoli e abbinabili su qualsiasi arredo","5,0"
prodotto amazon  molto  carino,"la forma è molto carina , una sferA CON LA BASE che s illumina , con bei colori , utili a capire lo stato della sfera , il volume massimo andrebbe migliorato , l ho comprato perchè enfatizzavano nella caratteristiche il suono     l  app per gestirlo andrebbe semplificata , io ho l account prime e mi era arrivata una mail in cui si diceva che potevo ascoltare liberamente la musica , ma non mi fa scegliere i brani , me li mette simili  L interfaccia dell app alexa crea confusione , bisogna schematizzarla meglio","4,0"
Difficoltà nella connessione Bluetooth non ha uscita aux,                    Impossibile caricare il contenuto multimediale                  Ho la prima versione di Alexa e si connette benissimo alla sound bar LG  Questa ultima versione di 5  generazione non la rileva neanche con la app Alexa Successivamente ho provato a collegare un Alexa di 4 generazione e si è collegata all istante  Nel frattempo mi ha scritto l assistenza di Amazon ed ho riprovato a riavviare Alexa e si è collegata  Nel primo collegamento ha fatto un aggiornamento software probabilmente era necessario riavviare Alexa  Do 4 stelle perché le versioni precedenti hanno l uscita Aux   In questa il cavo di collegamento è bianco con Alexa nera  ,"4,0"
strumento carino e comodo,"ero un po  perplesso, ma riconosco che sia comodo","4,0"
Ottimo prodotto!!!,Ottimo prodotto   molto efficiente   e molto utile in campo  appuntamenti     lista spesa   timer   10 lode  ,"5,0"
Grande speaker,La base per una casa domotica,"5,0"
una costante nella qualità echo dot !!!,"affidabilità confermata nel tempo, una costante di qualità  Nel mio caso una aggiunta all echo dot che ho nel mio appartamento, di facile abbinamento     e quindi di massima compatibilità con quanto già presente ed abbinato    Grande prodotto   ","5,0"
Prodotto buono,Per chi conosce gia questo prodotto non ha bisogno di presentazioni  Comodo il sensore per spegnere la sveglia o la musica al tocco ,"5,0"
Semplicemente strepitosa,Sbalorditivo  Nulla da aggiungere,"5,0"
Fa' il suo,"Come da titolo  Fa  il suo  NOTA NEGATIVA  non apprezzo invece l automatismo con cui il sistema, a seguito di richieste musicali, richieda il consenso a sottoscrivere attivazione upgrade e relativi periodi di prova ","4,0"
Regalo,Bellissimo colore,"5,0"
Buono,Buona,"5,0"
comodo e utile,bell acquisto,"5,0"
Echo Dott,Mi diverto molto con Alexa  Con prime tutto arriva in fretta ,"5,0"
Regalo perfetto!!!!,"Davvero divertente e facile da usare, comoda per le attività di tutti i giorni all interno della vostra abitazione Ne ho acquistate due , una come regalo per mio padre e devo dire che si possono fare davvero tante cose  Utili per controllare prodotti smart Home e divertente nella personalizzazione e nell ascolto della musica che preferiamo Consigliato   ","4,0"
Buono,Buono,"5,0"
Ottimo e semplice da usare e utile.,"Questo è il secondo che ho acquistato, oltre alle funzioni per accendere luci, attivare tramite comandi vocali elettrodomestici collegati ad una presa, ho insegnato alle mie nipotine di 4 anni ad utilizzare Alexa per telefonare a noi tutti della famiglia senza utilizzare nessun telefono, una volta sincronizzata la rubrica dei contatti tramite l APP di Alexa installata sul telefono di famiglia ","5,0"
Semplicemente Alexa,"Ecco, ovviamente la prima cosa che volevo fare è proprio cambiare il nome, lo renderanno mai possibile  Ma per il resto fa quello che deve fare, qualità del suono e del microfono più che soddisfacenti, lo comando da una stanza all altra senza problemi e senza urlare    ","5,0"
Perfetta,Super utile veramente ok vale la pena,"5,0"
Alexa,"Ottimo prodotto, Alexa è una compagna veramente eccezionale, Echo dot di 5  generazione affidabile e si sente benissimo  Ottimo acquisto","5,0"
Se potete fatevi un regalo,"Si puó sicuramente vivere anche senza, ma se vi capita di trovarla a metà prezzo, allora è un vero affare  Fatevi un regalo","5,0"
Alexa,Tiene compagnia con la musica che vuoi,"5,0"
Utile,"Bella, mia mamma la adora","4,0"
Top,"Arrivata in un giorno, regalata a un parente per Natale, è stato un regalo apprezzatissimo  Ha acquistato anche le lampadine apposite così che la mattina, tramite comando, è Alexa che le accende  L installazione è semplice e il prezzo competitivo ","5,0"
comodo,"Direi che è un acquisto azzeccato   anche se mi prendo un po  di tempo per una valutazione completa  Anche se paragonato con Echo Dot 3  generazione, che avevo già, posso dire la qualità del suono è sicuramente migliore","4,0"
Ottimo!,Senza Alexa a casa non possiamo più stare    È di famiglia ormai  presa in offerta ottimo affare ,"5,0"
Amazon .. Amazon ...,"Presa così, singolarmente è totalmente inutile per chi la compra e quindi per quanto poco costi costa sempre troppo Utilissima però per Amazon che tramite la  pallina  invoglierà l utente ad acquistare servizi aggiuntivi Ad esempio suona quello che vuole lei, impossibile chiedere una canzone, un cd, anche solo canzoni varie di un interprete     puoi scegliere soltanto il genere ed anche su quello    MA se fai l abbonamento la musica cambia    Carente anche come possibilità di configurazione, anche funzioni basilari, ad esempio c è il timer  utile per le uova sode , ma ti becchi la suoneria che vogliono loro Smetti di suonare quando esco e riprendi quando rientro     visto il microfono sembre attivo non dovrebbe poi essere così difficile Chiamate vocali tra vari utenti di icloud  Apple  esistono da sempre ed anche Amazon avrebbe il suo cloud, basterebbe copiare    Non dubito che creando un ecosistema Amazon la cosa possa migliorare e molto ma allora diventa impegnativo e non solo a livello economico ","3,0"
Mi piace,Facile da installare  Riconosce molto bene la voce  Molto carina da usare  Mi piace,"5,0"
Molto utile e divertente,"Perfetto, come in descrizione durante l acquisto Molto utile e divertente  Associata a lampadina e led per le camere, ottima","5,0"
Soddisfatto,Funziona bene    bella da vedere    ma la comodità di comandare con la voce diversi device non ha prezzo,"5,0"
Ormai mi aiuta in tutto,"Sveglie, promemoria, ricette, timer, comandi tramite prese apposite  Insomma una comodità assurda  Straconsiglio","5,0"
amissilleB,utileelitu VeramenteetnemareV,"5,0"
Benissimo,"È sempre perfetta, ne ho 4, peccato ogni tanto si perda dei comandi     migliorerà","5,0"
Suono,Ottimo   altoparlante eccezionali,"5,0"
Ottimo assistente di casa domotica,"Prodotto buono anche,il mio uso è prettamente per la domotica ","5,0"
Utile e funzionale,"Facile da usare e divertene, Utile per alcune routine ","5,0"
Inimitabile,"Bello, piccolo e potente, utile e versatile, ti fa anche compagnia","5,0"
Carina,"Audio buono, e anche utile nel utilizzo quotidiano  ","5,0"
Soddisfatto,Articolo consegnato nei tempi e rispondente alla descrizione,"4,0"
Ottimo,"Una amica sul comodino , l ha amo","5,0"
Fantastico,"Che dire, semplicemente perfetto, in questo ultimo modello hanno notevolmente migliorato la qualità audio  In un mese non mi si è disconnesso praticamente mai ","5,0"
Ho qualche dubbio.,"Acquistato durante il periodo Black Friday  Il prezzo molto basso e quindi conveniente  Ma al collegamento ho avuto dei problemi  E tutt ora l app Alexa non si comporta come lo faceva con il primo Echo Dot  Ci è voluto un bel po  per calibrare la temperatura  Per il resto tutto ok, spero solo non mi sia stato inviato un prodotto usato ","4,0"
Alexia,Molto utile x me  perché come al solito dimentico tutto  e alexia mi aiuta tantissimo  Il prodotto è ottimo,"5,0"
BENE.,"AUDIO DISCRETO A PATTO DI NON ALZARE MOLTO IL VOLUME  ESTETICAMENTE ACCATTIVANTE   HA UN SENSORE DI TEMPERATURA CHE , CHIEDENDO, INFORMA SUI GRADI  DELLA STANZA IN CUI E  COLLOCATO  SENZA ABBONAMENTO PREMIUM SI ASCOLTANO I BRANI CASUALI  E NON QUELLI VOLUTI ","5,0"
Fantastico,"Dispositivo veloce, utile e ormai indispensabileL ho abbinato alle luci che si possono controllare con Alexa e il risultato è ottimo","5,0"
Problematica nell'installazione,Dopo non poche peripezie ero quasi tentato a rendere il prodotto    poi azzerato cioè disinstallato più volteOra sembra funzionare    ,"5,0"
Bel sistema.,"Facilità d installazione, difficoltà a riconoscere altri apparati blutooth ","4,0"
MUST BUY,Uso ogni giorno Alexa è non c è niente da dire può essere utile a tutti se si ha una casa tech,"5,0"
Ottimo assistente di casa,"Davvero pratico e funzionale, in pochissimo spazio si ha un ottimo hub interattivo e ottimo audio  Innumerevoli funzioni disponibili  Le uniche perché sono gli scenari poco che poco fanno interagire altri prodotti e il sensore di temperatura completamente sballato e non configurabile, speriamo che mettano rimedio","4,0"
Proviamo Alexa,"Ho già l assistente virtuale Google Home mini e mi trovo bene per la domotica della casa  Mi sono detto proviamo Alexa  Be a mio parere è tutto un altro mondo  Alexa è molto più orientata alla famiglia, con giochetti e altro  Poi per chi acquista regolarmente su Amazon è possibile stilare la lista della spesa, sia per prodotti alimentari che per tutti i prodotti presenti sullo store Amazon ","5,0"
Utile!,"Per una organizzazione e gestione perfetta in casa  Utile come sveglia al mattino  Se sussurri, risponde sussurrando ","5,0"
carino,"ottimo rapporto qualità prezzo, onestamente non ne faccio un grande uso, ma quando serve c è,","5,0"
Ok,Ok,"5,0"
bello,semplice da installare e poi veramente dà un sacco di informazioni,"5,0"
Bel prodotto,Alexa e un ottimo prodotto  può essere usato per intranimento e per molteplici cose,"5,0"
Alexa,                    Impossibile caricare il contenuto multimediale                  Utilissima e un po  irriverente    ,"5,0"
Funzionale,Ha dei bassi ottimi considerando quanto costa io la utilizzo principalmente per ascolrare musica come uno cassa e comodo anche la possibilità di chiamare l eco dot e di chiamare il telefono da esso capita molto spesso che lascio il telefono in giro per casa e non lo trovo,"4,0"
Ottimo,Ottimo prodotto arrivato nei tempi previsti senza alcun danno ,"5,0"
Meraviglioso...,Compatto e funzionale  Audio eccellente  Ottimo acquisto  Acquisterò altri uguali ,"5,0"
Certezza amazon,"4  eco che acquisto    Connesse tutte le camere di casa mia, insieme alle lampadine e alle prese intelligenti  Essenziali per rendere Smart la propria casa","5,0"
Echo dot 5° generazione,"Qualità del suono uguale all echo dot classico        Nulla di superiore solo il prezzo , configurazione e comandi classici     Personalmente penso non valga la Pena, se la differenza è solo la forma ","4,0"
Finalmente Alexa!,Finalmente anche io sono entrato nel mondo magico di Alexa  Sono contento perchè ora posso cominciare a esplorare il mondo dell intelligenza artificiale e della domotica  Un passo alla volra,"5,0"
buono,"Mi sembrava più grosso dalla foto, del resto fa quello per cui è programmato ","4,0"
Preferivo il modello cilindrico,"Ottimo prodotto, ma il suono è più scadente rispetto al modello cilindrico del 2018","4,0"
Funziona,"X avere alexa sempre pronta, solo uno sfizio ma ormai la tengo","5,0"
Utile,È un valido aiuto per la casa,"5,0"
Si può migliorare,"Adoro la tecnologia e mi piace molto usare Alexa x sveglie, timer, musica ecc , il problema è che spesso non sa rispondere a delle cose che le si chiede, esempio  eliminare una canzone dalla mia playlist   Non riesce a farlo  Bisogna lavorare sull  interazione  ","3,0"
Perfetto,Come gli altri prodotti Alexa funziona perfettamente,"5,0"
Buon suono anche per la musica,Bello da vedere e buon audio,"4,0"
Musica di qualità con prezzo irrisorio,Prodotto eccellente per dimensioni e sound,"5,0"
Ottimo ma non è ben spiegato....incasinato nell usarlo la prima volta,Ottimo ma non è ben spiegato    incasinato nell usarlo la prima volta,"4,0"
Favolosi,"Che dire sono piccoli ma hanno un audio fantastico messo in paragone con Echo dot3gen o echo dot4 gen, inoltre con i sensori di movimento e temperatura è l ottimo prezzo fanno il resto  Si possono creare molte routine  Per fortuna i microfoni sono sensibili e non bisogna gridare come matti , senza fare nomi echo show 5  Lo consiglio mi piace moltissimo","4,0"
Comoda,Facile da usare ,"5,0"
Finalmente! Questi funzionano bene e si sentono meglio,"Ne avevo due di quarta generazione e funzionavano male  audio che gracchiava in home theater con firestick  Il bello era che con i due di terza generazione tutto funzionava bene  Ora ho preso questa coppia di quinta generazione e tutto funziona bene di nuovo  Quelli di quarta non andavano bene, problemi di audio gracchiante  Inoltre, questi di quinta hanno pure il sensore di temperatura  Lasciate perdere quelli di quarta  Terza generazione per risparmiare, quinta per avere qualcosa in più sull audio ed il sensore di temperatura ","5,0"
Cambia la tua vita con Alexa!,"Ho comprato questo Echo Dot durante il Black Friday dato lo sconto, ed è incredibile quanto si sia integrato facilmente nella mia quotidianità Comodo poter spegnere ed accendere luci con i comandi vocali, ricevere informazioni o semplicemente fare una chiacchierata con le svariate possibilità che offre Alexa Unica pecca è il filo bianco che viene fornito con la colorazione antracite, che per chi come me ha delle manie di perfezionismo si ritrova a comprarne uno di colore nero a parte ","5,0"
Prodotto perfetto in tutto,Il prodotto è arrivato in ottime condizioni e soprattutto il giorno dopo mi ha salvato in calcio d angolo per un regalo ,"5,0"
Elegante e funzionale,"Preso per sostituire un vecchio Echo Dot di prima generazione spostato in camera da letto con l audio ormai un po   gracchiante   Si inserisce perfettamente nell arredamento ed il suono è decisamente migliore del primo dispositivo, anche se migliorabile Peccato per il cavo USB che nell altro era nero come il dispositivo e in questo caso è bianco e dunque gli si abbina poco ","5,0"
Buono,Arrivato in tempi previsti i miei figli si divertono un sacco  ,"5,0"
Ok,Ok,"4,0"
Ottimo,Avevo visto la terza generazione a casa di un amico e mi sono convinto a comprarla anche io,"5,0"
Davvero bello,Preso in super offerta e completamente soddisfatto sia per l apparecchio sia per l utilità,"5,0"
Pagamento abbonamento,Nella descrizione del prodotto non ho letto che dopo 30 giorni bisogna  pagare abbonamento per usare le sue funzioni  Perché ,"4,0"
Molto utile ascoltare musica chiedere informazioni e tanto altro,Molto utile ascoltare musica chiedere informazioni e tanto altro,"5,0"
Unica pecca l’alimentatore bianco,Alimentatore bianco con dispositivo nero  non mi piace  A parte questo ottimo  Comoda la funzione di rilevamento a ultrasuoni del movimento  La rilevazione della temperatura ambiente è in modalità sperimentale e sarebbe comodo se potessi chiedere al dispositivo quale temperatura rileva Buono il suono  oltre quanto ci si può attendere da un piccolo dispositivo   ,"4,0"
Altoparlante Amazon,Semplicemente perfetto  Che dire  È Amazon   Ho detto tutto,"5,0"
Utile e divertente,"Mi piace la comodità di poter attivare funzioni, creare liste, promemoria ed ascoltare musica Vorrei che fosse possibile effettuare chiamate telefoniche con Alexa, mia suocera è non vedente, per lei sarebbe utile chiedere ad Alexa di chiamarenumeri telefonici  Ora è possibile solo sui contatti con profilo amazon","5,0"
Ottimo,Alexa non delude mai in ogni sua forma e colore,"5,0"
comdo e divertente,è stato un regalo per mia moglie ma devo dire che è molto comodo per sentire la radio o mettere un timer,"4,0"
Consiglio,"Puntuale la consegna, facile l installazione peccato che il filo dell alimentazione sia bianco e non nero ","4,0"
ottima,non potrei più farne a meno,"5,0"
leggere bene le istruzioni,"mi è piaciuto che una volta riuscito ad attivarla è una vera compagnia e soddisfa le mie richieste, l unico inconveniente ciò messo un pò ad attivarla,ma io non sono molto tecnologico poi come per magia siè attivata da sola,che bello ","4,0"
Buona ma non ottima,Risente ancora delle lacune sull audio e sulla comprensione delle domande Forma accattivante ma c è ancora da lavorare Molto Meglio un qualsiasi echo show   Ho,"3,0"
Buon prodotto,Buon prodotto qualche problema a connettersi con qualche dispositivo come TV lg,"4,0"
Prodotto ottimo!,L ho regalata ai miei nonni ultra ottantenni per permettere anche a loro di essere sempre connessi e in compagnia  L ho settata con promemoria per le medicine e una serie di Routine per tenerli comunque sempre aggiornati  Sono molto contento dell acquisto e anche loro lo sono ,"4,0"
Suono piacevole,Il suono è piacevole e la sua funzionalità buona ,"4,0"
