Title,Body,Stars
molto carina,molto carina ma devo dire un po  più  lenta  la prima configurazione rispetto alla 3 gen ottimo il termometro integrato cosi da chiedere la temperatura interna o utilizzarla per automazioni e routine,"4,0"
classe inferiore rispetto la 4,preferisco la 4 generazione,"4,0"
Sempre il Top,"Ho acquistato questo Echo in sostituzione di un Echo Dot di 3  Gen  2019  I bassi sono molto più profondi e la qualità audio è ottima Anche il riconoscimento vocale mi sembra molto più performante Ho provato a programmare delle skill utilizzando il sensore ad ultrasuoni per il rilevamento della presenza nella stanza, ma non funziona per nulla bene A parte questo consiglio l acquisto","5,0"
Perfetto e funzionale,Tutto ottimo  Funziona alla perfezione  Design carino ,"4,0"
Non tutte le tv si possono collegare facilmente,Buona,"4,0"
Semplice da usare, ,"4,0"
Coinvolgente!!!!!,Divertente  ,"4,0"
Alexa,Funziona bene  Molto bella la funzione per sentire la presenza di persone nelle vicinanze  so possono impostare automatismi ad orari del giorno precisi a seconda che Alexa senta la presenza di qualcuno in casa o meno,"5,0"
Facile nell’uso basico,Piacevole,"4,0"
semplice e pratico come tutti i prodotti Alexa,"Ho già altri di questi prodotti e li trovo molto utili e comodi sia per ascoltare la radio e o la musica che per gestire gli elettrodomestici di casa o l impianto di climatizzazione senza doversi scomodare ad alzarsi a cercare i vari telecomandi Inoltre è comodo per fare brevi ricerche o piccoli intrattenimenti con gli amici, è possibile anche personalizzare alcune funzioni e o routine, meglio di così che altro ","5,0"
Dipende per cosa si utilizza,"L ho acquistata per usarla come cassa per la musica , peccato che alla maggior parte delle nostre richieste musicali , Alexa rispondeva che ci andava l abbonamento specifico per la musica   noi abbiamo prime ma non era sufficiente Non utilizzandola per la domotica abbiano fatto il reso perché inutile per le nostre esigenze Do 3 stelle perché non è ben chiaro prima dell acquisto quanto sia necessario l  abbonamento all music per ascoltare la musica da noi richiesta , alla fine metteva lei della musica simile","3,0"
Ottimo acquisto,Utile nella gestione dei dispositivi per casa intelligente ma anche per l intrattenimento,"5,0"
il miglior echo per qualità prezzo,il miglior echo per qualità prezzo,"5,0"
Adoro,Non ti fa ascoltare sempre quello che vuoi bisognerebbe avere Amazon music,"4,0"
BUON PRODOTTO,REGALO PER APPASSIONATO CHE HA TUTTE LE GENERAZIONI,"5,0"
Una garanzia,"Ho già in casa un alexa vecchia generazione e ho deciso di allargare la famiglia dei dispositivi intelligenti comprando questo, che dire   le funzionalità di alexa di sempre ma con un audio sicuramente migliore In offerta poi davvero conveniente ","5,0"
Ottimo,Molto soddisfatto,"5,0"
Fa il suo,"Ho comprato il prodotto il primo giorno di black friday, quindi il 18 11, ad un buon prezzo, il prodotto è un buon prodotto, riconosce bene la voce quando la chiami e può rivelarsi utile in determinate situazioni ","4,0"
ottimo ma alcune funzioni sono da migliorare..,"note negative  il termometro interno indica 2 gradi in meno, la routine che usa gli ultrasuoni funziona la prima volta, poi smette di funzionare per un po  di tempo","4,0"
Comoda,Comoda per gestire le apparecchiature compatibili Riproduce la musica con un volume bello alto  Certamente non ha la composita di una cassa di fascia alta ma fa il suo lavoro,"4,0"
Ottimo prodotto,Ne ho già un altro,"4,0"
Autoparlante TOP !,"Tutto super, la musica si sente benissimo, mi piacerebbe ci fossero più App da poter aggiungere ad Alexa ad esempio Storytel      ","4,0"
Tutto ok.,Regalo di natale,"4,0"
Alexa!,Non ci sono dubbi su alexa  Ottimo prodotto   fa veramente tutto  Da sistemare secondo me le skill   ho un tv samsung 55  2021 e fa fatica ad interagire ,"4,0"
Favoloso !!!!!,Ottimo    ,"4,0"
Ottimo,Cosa dire assolutamente perfetto,"5,0"
Bello,Bella e utile,"4,0"
ottimo prodotto,"tutto perfetto, ma per installarla ho dovuto chiamare un tecnico  Non è poi così semplice come dicono ","5,0"
Ottima,Comoda e facile da installare,"4,0"
non sente niente,"Acquistato nella speranza che fosse migliore del mio vecchio echo dot  La qualità del suono è sicuramente migliore, tuttavia se il vecchio sentiva la mia voce una volta su tre, questo è pure peggio  Inoltre molto spesso le risposte sono veramente lente, troppo lente per essere utili  Peccato ","3,0"
UNA BELLA COMPAGNIA,LHO ACQUISTATA SOPRATUTTO PER L ASCOLTO DELLA MUSICA ED HA UN AUDIO DAVVERO OTTIMO  OTTIMO IL RICNOSCIMENTO VOCALEUN PICCOLO OGGETTO CHE ANCHE VISIVAMENTE FA E  CARINO DA VEDERE   ,"5,0"
Fa tutto tranne cucinare 😂,Semplice e carino finalmente un dispositivo che mi ubbidisce non come la moglie  ,"5,0"
Ottimo,"Ottimo Echo dot,unica pecca l audio,ma per il resto Ottimo prodotto ","5,0"
Non si capisce niente,"Solo le donanda facile,Alexa, che ore sono Alexa, com è il tempo Altrimenti  Alexa, accendi luce Alexa, le luce Alexa, accendi lampadario Alexaaaaaa, lampa accendi Alexa  Per favore accendi la luce Va be alzo io e accendo  ","3,0"
Dovrebbero averlo tutti,Ne avevo già una in cada e ne ho comprata un altra per mio cognato È un oggetto comodissimo soprattutto se associato ad altri come TV e lampadine Non uso più gli interruttori e lo trovo comodissimo È comodo anche per ascoltare musica e come timer Può essere usato come vivavoce e per fare chiamate se collegato al telefono Eccellente ,"5,0"
Ottima offerta,"Bello nello stile, suono non eccellente ma adatto al prodotto, semplice da installare Consegna perfetta","4,0"
Ottimo,Sempre un grande prodotto ed il suono è ottimo,"5,0"
Ok,Mi piace però troppe cose a pagamento tipo per ascoltare la musica   ,"4,0"
Buon prodotto,Prodotto di buona qualità e facile de usare e configurare,"4,0"
Mi piace? Si!! Se ne può fare a meno? Certo.,"È un giocattolo molto carino  Aexa è simpatica e mi ci sto affezionando  Audio sorprendente per le dimensioni dell oggetto  Molto antipatica la pubblicità troppo lunga di Amazon music, Jeff Bezos intervieni per favore  A questo per comandare le luci in sotto e grazie al cielo che l ho acquistato perché avendo appena rotto due costole non potrei farne a meno  In conclusione, a  prezzo pieno no, scontato si ","5,0"
Performante,"Acquistato in offerta durante il black Friday, ottima qualità, molto performante Amazon non tradisce mai ","4,0"
Ottima se presa ad un ottimo prezzo,"Presa a 24,99 durante il Black Friday, un ottimo affare  Design minimalista ed elegante, fa la sua figura in casa, piccola e potente, suono chiaro e microfono perfetto  Per me questa quinta generazione è promossa ","4,0"
Bella vediamo se va bene,E solo qualche giorno che la ho alcune volte fa capricci magari sono io che non me la cavo con tecnologia però non riesco a collegarla ne alla tv ne alla mia Barra della Bose ,"4,0"
Vince echo dot 3,"Deluso da come la versione 3 risulti molto più potente di questa  Per il resto tutto come da descrizione, semplice nella configurazione ed essenziale nei comandi  Il prossimo che acquisterò sarà la versione studio ","4,0"
Un di più a tutto il resto,"L ho regalato a mio marito,per me si può fare a meno,non li trovo utilità,inn casa lavatrice,asciugatrice,lavastoviglie ect si programma con il cellulare,per altre cose come luci sempre con app del Cell ,sveglie app e altro Google è sempre al primo posto,devo dire che però per la musica nulla a togliere, ha un suono multo buono ma se tornasse in dietro ne farei a meno ","3,0"
Ottimo,"ottimo prodotto, facile da usare e installare","4,0"
Alexa,Non mi è piaciuto il fatto che il volume dell audio e troppo basso,"3,0"
Funzionale,"Ogni tanto fa i capricci che non dice nulla di  quello he gli chiediamo, ma nel complesso va benissimo","4,0"
Interessante aiuto,Un aiuto interessante,"4,0"
Qualità /prezzo,Facile da usare  Consigliato,"4,0"
Ottimo prodotto qualità prezzo semplice istallazione consiglio,Semplice istallazione,"4,0"
Alexa,E piccola ma ha un suono spettacolo Mi piace un sacco regalate a natale anche hai miei genitori e miei suoceriOttimo tuttoImpacchettamwnto spedizione  Prodotto e consegna  ora voglio le lampadine appena potrò  me le regalo ,"5,0"
Ottimo strumento,"Già ho un Echo dot, questo in aggiunta rende l utilizzo di Alexa più confortevole  Prezzo qualità eccellente  Suono buono, ricezione e configurazione eccellenti      ne consiglio l acquisto a chi vuole completare al meglio il sistema di assistenza Alexa ","5,0"
Echo dot,"Interesante, buon rapporto qualità prezzo  Ma il giorno dopo del acquisto costava di meno ","5,0"
Ottimo,Buon prodotto,"5,0"
Bello ma peccato che il filo di alimentazione non sia dello stesso colore del Eco....peccato,,"4,0"
"Radio, musica e lista della spesa mi hanno conquistato.",La comodità di avere la radio e la musica sempre disponibile semplicemente parlando E il poter aggiungere appuntamenti e lista della spesa parlando mentre stai facendo altro sono state le cose che mi hanno conquistato  ,"5,0"
Upgrade rispetto all'echodot piatto,Il suono è sicuramente migliore rispetto alla generazione  piatta  ma chissà perché con il nuovo echodot Alexa mi sembra più dura d orecchio  ,"4,0"
Echo quelli che ci voleva💪,Echo dot ottimo,"4,0"
Fantastico,Questa Alexa mi piace tantissimo è molto intelligente e riesce a rispondere subito in modo preciso a qualsiasi domanda  È comodissima e potrebbe essere anche un idea regalo La consiglio ,"5,0"
Da provare,Veramente utile anche per le piccole cose come un timer o compagnia  ,"5,0"
facile da usare,"facile da usare e istallare,molte funzioni che si possono attivare ","4,0"
Top,Veramente ottima qualità prezzo molto buono   leggera e bella,"5,0"
sempre piu Alexa,"Alexa è sempre Alexa, riconoscimento vocale al top, un sacco di funzioni, tanta interattività questa generazione del prodotto base  24 euro in black friday  è qualcosa di più  l estetica è diventata molto più moderna l installazione è qualcosa di straordinario  scarichi l app, accedi ad alexa ed è tutto fatto  la diffusione sonora è sempre più coinvolgente in poche parole  oltre la solita radio, oltre al solito assistente personale  semplicemente ALEXA ","5,0"
Facile da configurare,Migliorato io suono rispetto alle versioni precedenti  Materiale di qualità,"4,0"
Buono ma non ottimo.,"Esteticamente gradevole, perfettamente funzionante  Pensavo che l audio fosse nettamente migliore della precedente versione, invece lo è ma di poco ","4,0"
Ottimo,"Ottima qualità prezzo, funzionalità ottima","5,0"
Alexa,Suono perfetto ed esteticamente molto carino,"5,0"
Buon prodotto,"Ottimo prodotto,e semplice da installare","5,0"
wow,"acquistata Alexa come regalo di natale, alla fine era un regalo boomerang per me    riconosce bene ed anche da distanza la richiesta, il suono è potente e pulito  io la trovo molto utile","5,0"
Buon prodotto!,Buon prodotto  Da migliorare la configurabilità che direi limitata ,"4,0"
Come da aspettative,"Per la grandezza, più che buona ","4,0"
Semplicemente stupendo!,"Questo modello è stupendo, piccolo e ugualmente potente  Oramai non posso più farne a meno di questi echo li ho messi uno per ogni stanza e ho reso la mia casa tecnologica e più confortevole  Anche mia figlia si diverte chiamando Alexa per mettere musica o chiedere di accendere le luci  ","5,0"
Perfetta.,"Perfetta  Altoparlante davvero molto potente, e si può appunto collegare anche ad un dispositivo ed usarla come una normale cassa, oppure alla Fire TV per avere un audio migliore  Riesce a sentirmi dal secondo piano e l Echo Dot si trova al quarto  Consegna sempre in tempo  Assolutamente consigliata ","5,0"
Fantastico,Fantastico,"5,0"
Funziona bene,Ottima,"5,0"
Ottimo Prodotto,"Spedizione e consegna come sempre perfette  Ho acquistato il prodotto per domotizzare la mia casa  Installazione semplice e leggendo il manuale diventa ancora più facile  Ho acquistato anche delle prese wi fi per attaccarci delle luci  Semplice l abbinamento con queste prese  Il prodotto è molto piccolo non credevo, quindi dal mio punto di vista è perfetto  Altoparlanti top  Consiglio vivamente questo prodotto ","5,0"
Alexa,Semplicemente soddisfatta dell articolo acquistato ,"5,0"
buono,buono,"4,0"
Ottimo,Tutto come descritto,"5,0"
Alexa ci sei?,Ottimo prodotto per il prezzo richiesto  Nulla piu,"4,0"
Comodo,Utile da viaggio,"5,0"
Efficienza,Per ascoltare musica,"4,0"
Qualità prezzo top,"Ti regala moltissime informazioni in istantanea, ti permette di ascoltare tutti i tipi di musica a tuo piacimento ","5,0"
Troppo carino,"Ottimo prodotto , fatto bene ,suona bene e risponde a tutti i commandi  ","5,0"
Sempre una garanzia,"Ottimo prodotto, musica, promemoria, lista spesa, accensione e spegnimento lampade con presa ecodot","5,0"
Impressionante,"Prima volta che acquisto un echo e devo dire di essermi sbalordito Pro  Qualità audio eccellente Possibilità di impostare sveglie, promemoria Chiedere la qualsiasi Gestire tutto quello che è compatibile con AlexaContro  Abituarsi ad utilizzarla","5,0"
Alexa,Ottimo,"4,0"
Un altra vita!,Non risponde a tutte le domande ma ne sono più che soddisfatta,"5,0"
"Alexa, che altro dire?","Ormai tutti conosciamo Alexa Comprata in offerta speciale, quindi soddisfatto del prezzo Unica pecca  se vogliamo trovarne  è che mi aspettavo la potenza della cassa un po  più forte rispetto al modello base Cmq soddisfatto","5,0"
buono,qulità prezzo,"4,0"
Alexa mettimi su della musica rilassante!,"Ero scettico, ma visti i prezzi del Black Friday ne ho preso uno e poi spinto dall entusiasmo, anche uno per il piano superiore Per ora li uso per comandare delle prese wifi, per mettere della musica  si sente benissimo  , per ascoltare la radio in streaming, come interfono tra i due echo dot, per avere informazioni  Pensavo che parlare con una palla nera sarebbe stato più faticoso, invece dopo un po  è abbastanza rilassante e veloce ","5,0"
Modificalo,Fantastico perché puoi mettere le risposte che vuoi farti sentire attenzione però alle parolacce è alcune parole osé quelle non li sopporta molto divertente suono molto migliorato impostate Spotify con le vostre playlist ve lo consiglio  per evitare spiacevoli abbonamenti con app del Cell del PC portatile e tablet Alexa funziona anche  quando non sei a casa basta avere una connessione dati,"5,0"
una certezza,"articolo funzionante , ottimo come compagnia per musica , meteo , lista della spesa ,e ottimo come hub per comandi domotici ,molto intuitivo si configura in 3 minuti","5,0"
Buono ma non troppo,"Prodotto comprato da un paio di mesi, scegliendo una versione più nuova di un echo acquistato qualche anno fa, ma a parte la qualità del suono che effettivamente è migliore per il resto non ha nulla da invidiare rispetto a una generazione più vecchia, spesso e volentieri non ascolta e nemmeno risponde, ho provato già due volte a resettarlo ma non cambia praticamente nulla","3,0"
Ottimo prodotto,"Ottimo prodotto, facile installazione e molto comodo","4,0"
Una sicurezza,"Possiedo già altri 2 echo dot 3  generazione, quindi conosco molto bene il prodotto ed anche l installazione è stata immediata Ho fatto l upgrade comprando la 5  generazione sicuro di tutto i miglioramenti  ","5,0"
Ottimo,Finalmente un dispositivo tecnologico facile da usare per tutti anche per persone non esperte Il suono ottimo    Per la musica  dopo il primo mese serve abbonamento Amazon Music     ,"5,0"
Se piace l'estetista è un ottimo prodotto,"Non ero convinto dell acquisto, non è piccolo come il vecchio dot, non è grande e performante come il plus  personalmente non apprezzo particolarmente nemmeno la forma sferica Una volta installato non è brutto come pensavo, ma soprattutto funziona benissimo, anche l audio ben sopra le aspettative Bella sorpresa","5,0"
Ottimo,"La semplicità  per installarlo , è la bellezza del prodotto ,Qualità prezzo , perfetto","4,0"
Alexa,Buon prodotto x il costo,"4,0"
Elegantwle,Design elegante ed ottima qualità audio,"4,0"
Ottimo qualità prezzo,Ottimo qualità prezzo,"4,0"
Un buon acquisto,Ero una delle poche che ancora non ce l aveva  la utilizzo principalmente per la diffusione del suono e per ascoltare musica ,"5,0"
Indispensabile,"Audio fantastico, facile da usare, stile elegante","4,0"
ECHO DOT,Il dispositivo è facile da istallare   ha un buon riconoscimento vocale ed una buona qualità del suono   consiglio l acquisto,"5,0"
Microfono migliorato e sensore di temperatura!,                    Impossibile caricare il contenuto multimediale                    Alexa è ancora più reattiva nella sua quinta versione  Ora ha anche un sensore di temperatura che potrà dirvi grandi gradi ci sono nella vostra stanza  Il microfono inoltre è più ricettivo   La configurazione è più rapida se associate il vostro account già all acquisto   Rimane ancora un po  limitata su alcune cose ,"5,0"
Semplicemente perfetto,Semplice da installare  Riconosce bene la voce di qualsiasi persona  L audio é molto buono per un oggetto così piccolo,"5,0"
Idea regalo,"L ho regalato per Natale ad una famiglia di amici  Ho fatto un figurone, tutti contenti specialmente i figli ","5,0"
Suono pulito,E  poco ingombrante,"4,0"
Ottimo,"Arrivato in perfetto condizioni, facile da installare, casse veramente molto buone Prodotto consigliato ","5,0"
Un vero amico,,"4,0"
Ottima idea regalo,L ho preso come regalo La persona che l ha ricevuto ne è entusiasta ,"5,0"
Ottimo,"Ottimo prodotto ,ma perché non si collega con tv samsung ","5,0"
Funzionante,"Oramai ho vari accessori alexa,aiutano in tante cose,consiglio acquisto","5,0"
Top I A,"Utile, semplice da configurare e efficiente intelligenza artificiale","5,0"
mai più senza,"Ho comperato questo modello di echo dot in offerta ed è stato un ottimo acquisto  Il suono è chiaro, limpido  Le risposte sono rapide ed è faci l instllazione e la configurazione se volete compagnia è un buon aiuto Io lo uso anche per leggere i miei ebook mentre faccio altro in casa Consigliatissimo","5,0"
"Comodissimo, Alexa fa parte della famiglia","Alexa, molto comodo un membro in più in famiglia Canta, riproduce musica , temperatura, meteo ecc  molto comodo con i wi fi ma cn hotspot mobile po meno perché ogni volta devo configurarlo  Migliorerei la connessione con hotspot mobile con smartphone Oltretutto, va benissimo tutto ok  Audio bello potente e suono pulito con bei bassi  Offertissima con black friday ","5,0"
Che per poterlo installare devi avere una connessione Wi-Fi,Mi sono fatto questo regalo natalizio e devo dire che pur avendo avuto delle difficoltà nel poterlo installare per via della configurazione ma poi dopo ce l ho fatta,"5,0"
Perfetto,"E stato un regalo, e sono molto contenti, ha molte funzioni, lo usa sempre, mette musica canta canzoncine, barzellette e c è anche la sfera magica, è stupendo, l acquisto migliore che potessi fare","5,0"
Entusiasta!,"Ne ho già un modello datato e questo, preso durante il black friday, non era indispensabile     ma non tornerei indietro  La qualità dell audio è superiore e sentire alexa nel primo modello e poi nel secondo      è come se avesse fatto un corso di dizione  con i bassi più profondi e caldi   DFantastico ","5,0"
Ottimo prodoto,Facile da gestire,"5,0"
Buon prodotto,"Ottima qualità audio, estetica piacevole, funzionamento perfetto","4,0"
Utilissimo,"È il sesto che compro  Si integra perfettamente con i suoi fratelli  Utilissimo per mille usi  Dalla   robotizzazione  della casa ,come agenda,sveglia,in cucina ecc ecc","5,0"
Ottimo!,"Presa per il black Friday, a quel prezzo è da prendere ","4,0"
Alexa,Il top condigliatissimo,"5,0"
Nuova alexa 5° generazione,"Perfettamente funzionante, facile da istallare e usare  Un valido supporto in casa  Ho collegato il sistema di allarme e le lampadine ","5,0"
Dispositivo intelligente fantastico !!!!,"Dispositivo intelligente fantastico dotato di una sonorità, viste le dimensioni, superba  Va detto che per renderla efficiente al 100  ci vuole un po  di tempo, specialmente per la musica che può essere sincronizzata anche da spotfy e ascoltata da molte radio tramite da App Alexa  Si può chiedere tutto ad Alexa, o quasi, chi non la prova non ci crede    ","5,0"
Una garanzia,"Dopo averlo ricevuto , ho deciso di acquistarlo per fare un regalo utile  Questa nuova versione è decisamente superiore alla precedente    ottimo prodotto","5,0"
Ok,Perfetto,"4,0"
pratico,nuove casse in sostituzione della serie 3,"4,0"
Eccellente,X me,"4,0"
Importante la composizione delle SKILL,"Buon disegno, ottimo saund ","4,0"
Buon prodotto,Buon prodotto,"4,0"
buono,utile e fa molta compagnia,"4,0"
"Alexa, utile assistente","Ho acquistato Alexa avendo ponderato se mi servisse effettivamente in casa e devo dire che in questo piccolo periodo da quando l ho acquistato mi ha sorpreso molto  Audio abbastanza forte e chiaro, configurazione facilissima, alcune skill dovrebbero essere migliorate ma per il momento mi ritengo molto soddisfatto dell acquisto ","5,0"
Bello e funzionale,"Facile da installare, bello e funzionale  Mi piace","4,0"
Ottimo,"Ottima idea  Ne ho comprate 2 perchè è divertente, utile, facile , comodissima","5,0"
Bello peccato non esce l'alimentatore per usarlo senza filo,Bello peccato non esce l alimentatore per usarlo,"4,0"
Ottimo prodotto,Il prodotto è perfettamente funzioneOttima qualità prezzo,"5,0"
Non male,"Ho acquistato Alexa per la comodità di non dover avere sempre il telefono in mano per riprodurre i brani  Ideale,facile da istallare e voce chiara l unica pecca che se chiedi un brano specifico ti dice di entrare nel servizio a pagamento ","5,0"
Estetica veramente bella,L estetica del prodotto è proprio bella  E  facilmente collocabile in ogni ambiente sia moderno che antico  L ho acquistato per fare un regalo di Natale a miei genitori  Ben accetto e utilissimo,"5,0"
Ottimo,Ottimo per rendere più Smart la tua casa Alexa ha sempre la risposta pronta a tutto e con i vari accessori può essere sia utile che divertente,"5,0"
Restituisce un ottimo feel al tatto.,"Non ha bisogno di presentazioni, ho iniziato a domotizzare la mia casa  approfittando del black friday ho acquistato alcuni dispositivi alexa  Echo dot è il dispositivo giusto per gli ambieti meno frequentati , quelli che richiedono meno fronzoli e tanta sostanza sala hobbies, lavanderia,bagno   essenziale e funzionale  nulla da invidiare alla versione con l orologio ","5,0"
Top,"Ormai ho casa piena  che dire  Stupendo, utile, divertente  ","5,0"
Piccolo bello utilissimo,Mi è piaciuto tutto,"5,0"
sfiziosa,"sicuramente non è indispensabile ma avere Alexa in casa è un sfizio, molto carina e a mio parere tiene anche compagnia  la utilizzo principalmente per ascoltare la musica e mi trovo bene perchè quando sono impegnata in cucina non ho bisogno di toccare nulla per cambiare canzone ","5,0"
Facile e utile,Finché non lo hai non sai quanto ti è utile  Io lo uso come interfono tra i piani della casa e altro,"5,0"
Perfetta,"Ottimo prodotto,     l app è facilissima basta seguire le indicazioni,suono molto pulito e potenza ottimoa","5,0"
Buono,Da compagnia,"4,0"
Intelligente facile da installare,Riconosce la voce facilmente la musica è ottima e fard la lista della spesa senza dimenticarla a casa mi è utile,"5,0"
