Title,Body,Stars,Polarity,Polarity_Text
ne puoi fare a meno fin quando non lo provi ,  spedizione amazon sulle spedizione   una garanzia  meno di    ore per la consegna   imballaggio e confezione l echo dot   arrivato in una scatola amazon di cartone assieme ad altri prodotti  protetto da un foglio accartocciato di carta riciclata la confezione   in cartone  di colore blu  sopra   raffigurato l echo dot  il marchio amazon  il testo  echo dot  e per distinguerlo da quello di quarta generazione  in alto a destra un triangolino con stampigliato   th generazione   sul retro le diverse specifiche all interno della confezione oltre all echo dot  troviamo manualistica  una protezione in cartone  e alimentatore con cavo    recensione prodotto l amazon echo risulta di buona fattura  si presenta di forma sferica con   tastini superiormente e un ingresso al posteriore dedicato all alimentazione suddiviso in due parti  una in plastica che protegge l elettronica e la parte superiore in una sorta di retina dove   presente l altoparlante da     pollici di seguito alcune specifiche dimensioni      x     x    mmaltoparlanti  altoparlante da          mm  a diffusione anterioreformati audio supportati  audio ad alta definizione  senza perditemicrofono   integratosensore di temperatura  sipeso      grammiaudio  altoparlante da           mm  a diffusione anterioreuscita audio   noconnettivit  wi fi  il wi fi dual band   compatibile con reti        a b g n ac da     e   ghz  non compatibile con reti wi fi ad hoc  o peer to peer  protocolli per casa intelligente wi fi  bluetooth low energy meshconnettivit  bluetooth  compatibile con advanced audio distribution profile  a dp  per lo streaming di contenuti audio dal tuo dispositivo mobile a echo dot o da echo dot a un altoparlante bluetooth  audio video remote control profile  avrcp  per controllare i dispositivi mobili connessi tramite comando vocale requisiti di sistema  puoi connettere echo dot immediatamente al wi fi tramite l app alexadisponibile in diverse colorazioni io ho scelto la pi  classica antracite  elegante con il suo anello rgb posto sul fondo si adatta ad ogni stile ed arredamento  l unica pecca   data dall alimentatore che assieme al cavo   di colore bianco la configurazione   avvenuta in un lampo tramite l app alexa di amazon installata sullo smartphone  il wifi   stato subito riconosciuto e in pochi e semplici passi alexa ha preso vita le funzioni da utilizzare sono svariate  dal comandare una semplice lampadina o presa intelligente  a gestire autonomamente una routine  ovvero una serie di azioni la compatibilit  con altri accessori  anche di diverse marche    immediata questo grazie alle skills  una sorta di app di diversi fornitori da installare all interno dell echo dot personalmente ho collegato ad  alexa  qualche luce wifi  delle prese smart  una tv e videocamere di sorveglianza  tutto gestito nel migliore dei modi per attivarla basta pronunciare alexa e l azione da farle eseguire  il microfono   ottimo riesce a comprenderlo sempre o quasi  inoltre riconosce i comandi detti a voce bassa e ti risponde di conseguenza  utile di notte per evitare di fare rumore altra funzione interessante   data dalle routine  ovvero impostare una serie di azioni che alexa tramite l echo dot pu  svolgere autonomamente  partendo da un input come una frase  un rilevamento da un sensore  un suono o una presenza ad esempio ho impostato che la mattina in una precisa fascia oraria  al rilevamento di una persona nella stanza  si scendano le luci  alexa dia il buongiorno  notizie meteo e news del giorno  comodo  per impostare le routine anche il sensore di temperatura interno  che ad esempio pu  comandare il riscaldamento etc   sicuramente il sensore di presenza e di temperatura sono le chicche pi  importanti per questo nuovo echo dot oltre il domotizzare casa l eco dot ci da la possibilt  di avere vere e proprie interazioni con alexa  pu  raccontare una storia  una barzelletta  fare un gioco etc  inoltre   possibile ascoltare la radio  una canzone  chiamate  insomma l unica vera limitazione   la nostra fantasia dal punto di vista tecnico  l audio   spettacolare per essere cos  piccolo gli ingegneri che l hanno progettato hanno fatto un buon lavoro  i bassi sono corposi e il suono definito  il microfono  come detto in precedenza   di ottima qualit    conclusione io ero scettico  indeciso sull acquisto  probabilmente se non l avessi preso  non sarebbe cambiato nulla e avrei potuto farne a meno ancora per molto  ma ormai   pane quotidiano  impostare una sveglia  un promemoria  un timer  scrivere la lista della spesa  seguire una ricetta   diventato tutto pi  facile consiglio l acquisto  si e no  ovvero  dipende dall utilit  che pu  avere soggettivamente tecnicamente lo consiglio in modo spassionato  un gingillo tech di ottima fattura e bella presenza note dolenti come scritto precedentemente il filo e l alimentatore bianco rispetto al dot nero  e la mancanza di una uscita jack audio il prezzo giusto         a queste cifre   un affare ,"5,0",0.2335,Good
qualit  audio ottima  ma attenzione a disattivare la modalit  la rilevazione ad ultrasuoni ,l echo dot   un dispositivo interessante  ma ha alti e bassi iniziamo con il lato positivo  l audio dell echo dot   davvero sorprendente  nonostante le dimensioni compatte  riesce a produrre un suono chiaro e potente  sia che tu voglia ascoltare musica  podcast o semplicemente chiedere informazioni  l echo dot offre una buona esperienza sonora purtroppo  il riconoscimento vocale non   sempre all altezza  a volte alexa fatica a capire i comandi  interpretandoli in modo errato o ignorandoli completamente  questo pu  essere frustrante  soprattutto quando si desidera un esperienza fluida e senza intoppi  spero che in futuro vengano apportati miglioramenti a questo aspetto l integrazione degli ultrasuoni  promossa come una funzione innovativa dell echo dot  si   rivelata un flop la capacit  di rilevare la presenza attraverso gli ultrasuoni sembrava promettente  ma purtroppo ha causato problemi all audio  dopo aver utilizzato questa funzione  ho notato una netta diminuzione della qualit  del suono  il volume   diventato debole e il suono distorto  questo   un grande punto negativo  ho dovuto disabilitarla,"4,0",0.0809,Good
la domotica alla portata di tutti,  spedizione rapidissima come da tradizione amazon  echo arrivato in un giorno    recensione prodotto l amazon echo risulta di buona fattura  si presenta di forma sferica con   tastini superiormente e un ingresso al posteriore dedicato all alimentazione suddiviso in due parti  una in plastica che protegge l elettronica e la parte superiore in una sorta di retina dove   presente l altoparlante da     pollici di seguito alcune specifiche dimensioni      x     x    mmaltoparlanti  altoparlante da          mm  a diffusione anterioreformati audio supportati  audio ad alta definizione  senza perditemicrofono  integratosensore di temperatura  sipeso      grammiaudio  altoparlante da           mm  a diffusione anterioreuscita audio  noconnettivit  wi fi  il wi fi dual band   compatibile con reti        a b g n ac da     e   ghz  non compatibile con reti wi fi ad hoc  o peer to peer  protocolli per casa intelligente wi fi  bluetooth low energy meshconnettivit  bluetooth  compatibile con advanced audio distribution profile  a dp  per lo streaming di contenuti audio dal tuo dispositivo mobile a echo dot o da echo dot a un altoparlante bluetooth  audio video remote control profile  avrcp  per controllare i dispositivi mobili connessi tramite comando vocale disponibile in diverse colorazioni io ho scelto la pi  classica antracite  elegante con il suo anello rgb posto sul fondo si adatta ad ogni stile ed arredamento  l unica pecca   data dall alimentatore che assieme al cavo   di colore bianco la configurazione   avvenuta in un lampo tramite l app alexa di amazon installata sullo smartphone  il wifi   stato subito riconosciuto e in pochi e semplici passi alexa ha preso vita le funzioni da utilizzare sono svariate  dal comandare una semplice lampadina o presa intelligente  a gestire autonomamente una routine  ovvero una serie di azioni la compatibilit  con altri accessori  anche di diverse marche    immediata grazie alle skills installabili personalmente ho collegato ad  alexa  qualche luce wifi  delle prese smart  una tv e videocamere di sorveglianza  tutto gestito nel migliore dei modi per attivarla basta pronunciare alexa e l azione da farle eseguire  il microfono   ottimo riesce a comprenderlo sempre o quasi  inoltre riconosce i comandi detti a voce bassa e ti risponde di conseguenza  utile di notte per evitare di fare rumore altra funzione interessante   data dalle routine  ovvero impostare una serie di azioni che alexa tramite l echo dot pu  svolgere autonomamente  partendo da un input come una frase  un rilevamento da un sensore  un suono o una presenza sicuramente il sensore di presenza e di temperatura sono le chicche pi  importanti per questo nuovo echo dot oltre il domotizzare casa l eco dot ci da la possibilt  di avere vere e proprie interazioni con alexa  pu  raccontare una storia  una barzelletta  fare un gioco etc  inoltre   possibile ascoltare la radio  una canzone  chiamate  insomma l unica vera limitazione   la nostra fantasia   conclusione con soli       euro   possibile dotarsi di un hub con cui integrare moltissime skill domotiche consiglio l acquisto  si  ottimo upgrade per chi ha gi  alcuni dispositivi integrabili  lampade  termostato  prese smart  ,"5,0",0.4012,Good
echo dot    un assistente virtuale di qualit  superiore,ho acquistato l echo dot   e devo dire che sono rimasto completamente soddisfatto delle sue prestazioni  la qualit  del suono   sorprendente per un dispositivo di dimensioni cos  compatte  con bassi profondi e acuti cristallini che riempiono l ambiente  l assistente virtuale alexa   estremamente reattivo e intuitivo  rispondendo prontamente a tutte le mie richieste  inoltre  la connettivit  con altri dispositivi smart nella mia casa   stata senza problemi  consentendomi di controllare luci e molto altro ancora con semplici comandi vocali  l echo dot   si   dimostrato un alleato versatile e affidabile nella mia routine quotidiana  lo consiglio vivamente a chiunque sia alla ricerca di un assistente virtuale di qualit  superiore ,"5,0",-0.1788,Bad
buona  ma non perfetta,rispetto al precedente dot   pi  forte come suono  ma   molto pi  direzionale e il dialogo a volte si fatica a comprendere  anche perch  l eq vale solo per la musica  non alexa in se   sarebbe carina una modalit  per far livellare in automatico il volume in base all ambiente circostante le aggiunte di sensore a ultrasuoni e di temperature sono molto buone ,"4,0",0.25,Good
mi ha conquistato ,l ho acquistato cos   un po  per curiosit   ma sono rimasto conquistato dalla profondit  e purezza del suono  incredibile come un diffusore cos  piccolo possa essere non solo potente  ma fedele nella riproduzione senza distorcere a qualsiasi volume  applausi a scena aperta  brava alexa ,"5,0",-0.189,Bad
chi non lo conosce ,il piccolo assistente vocale di alexa  bello ed elegante  il suono  nonostante le dimensioni    chiaro e potente  la risposta alle richieste   immediata  l ho preso durante una delle tante promozioni e credo che alla prossima ne prender  un altro  anche perch  vorrei provare a collegarlo alla tv smart per realizzare una specie di impianto stereo wireless consigliato ,"5,0",0.2108,Good
bello ma ho fatto il reso,lo avevo preso per rispondere al citofono con ring intercom   ogni volta per aprire il cancelo dovevo dire un pin vocale   una menata    ho fatto il reso,"4,0",-0.1335,Bad
piccolo ma potente,dispositivo preso in accoppiata ad una lampadina smart  semplice nell installazione e veramente comodo nell uso quotidiano  non ha nulla da invidiare al  fratello pi  grande  in termini di audio  la sveglia mattutina si fa sentire forte e chiaro  da prendere se si vuole rendere la casa un po  pi  smart ,"5,0",0.2476,Good
dipendenza,non ti rendi conto della sua utilit  fin quando non lo compri  non riesci a farne pi  a mano  sembra una persona in pi  in casa  acquisto pi  che ottimo,"5,0",0.25,Good
presenza discreta ,da quando   arrivata a casa nostra ha subito preso il suo posto in cucina  viene spesso consultata da tutti noi     speriamo duri nel tempo      ,"5,0",0.186,Good
ottimo assistente virtuale,  un ottimo assistente virtuale  gli puoi chiedere di tutto senza distogliere le mani dalle attivit  che stai svolgendo  puoi telefonare agli altri utenti alexa  puoi chiedere calcoli ecc ecc      qualsiasi cosa,"5,0",0.25,Good
echo dot     generazione  modello      ,amazon echo dot   molto migliorato sia nella qualit  del suono  sia come prestazioni  il migliore fino ad ora ,"5,0",0.1212,Good
ottimo affare,acquistato in sconto insieme a ring intercom  avevo gi  un echo dot di generazione precedente e conoscevo gi  i pregi del prodotto  questo migliora la qualit  audio  in pi  ha un sensore di temperatura e pu  essere utilizzato come sensore di presenza  consiglio l acquisto,"5,0",0.0809,Good
ottimo,comprato un po  per gioco  devo dire che ha un ottimo suono  la musica si sente benissimo  un ottimo apparecchio ,"5,0",-0.2048,Bad
mai pi  senza ,ormai vivo ascoltando la musica solo con alexa    comoda e utile per molte altre cose    timer  sveglia ecc   ,"5,0",0.25,Good
ottimo,come le attese ,"4,0",0.25,Good
bello davvero,che dire   gi  il prodotto si conosce  per me molto utile e lo trovo bello esteticamente ,"5,0",-0.1335,Bad
davvero utile ,pensavo di trovare pi  difficolt  invece   programmato per rendere tutto pi  semplice e veloce anche nelle impostazioni  nei collegamenti ecc ottima potenza  bel designs,"5,0",0.25,Good
alexa  una garanzia ,ottimo prodotto  utile anche la funzione orologio ,"5,0",0.25,Good
comoda in casa ,che dire  ormai se non ce l hai la devi comprare ,"5,0",-0.1335,Bad
mi trovo bene  se lo programmi come si deve fa quello che chiedi,gi  scritto nel titolo  c   poco da dire di alexa,"5,0",-0.1335,Bad
consigliato ,ha molteplici funzioni   sempre pi  avanzate per una casa intelligente  migliorata nei comandi   un ottimo supporto per svolgere la propria routine giornaliera con semplicit  ,"5,0",0.186,Good
buon prodotto,audio un po cupo,"4,0",-0.173,Bad
ottima ,dispositivo dal design carino e dalle ottime propriet    consigliato ,"5,0",0.25,Good
alex,sonno soddisfatta del mio acquisto,"5,0",0.25,Good
felice,ho regalato questo dispositivo ai miei genitori  sono rimasti soddisfatti per la facilit  di installazione e per la qualit  audio,"5,0",0.25,Good
  un regalo,l ho scelto come regalo  per ora era felice    poi vediamo come sar  dopo l installazione  ma alexa dovrebbe essere una garanzia   ,"5,0",0.25,Good
ottima qualit ,buon suono  una cassa veramente economica e buonissima ,"5,0",0.25,Good
ottimo,prodotto eccellente  facile da configurare  il pacco ha rispettato i tempi,"5,0",0.186,Good
ottimo prodotto,comodo  si accende subito  e si collega sia ad internet che al cellulare istantaneamente  facilissimo da usare,"5,0",0.25,Good
articolo buono ma,articolo di buone caratteristiche tecniche ma utile solo per particolari utenti e tutto sommato superfluo,"4,0",0.25,Good
ottimo e funzionale prodotto a prezzo buono ,tutto ok  non c   nulla che non va  qualche problemino sulle impostazioni  ma niente di che ,"5,0",0.1684,Good
un affare se in offerta,ottimo suono  a prezzo pieno   costoso  ma in offerta   un acquisto consigliato,"5,0",0.25,Good
aiuta tantissimo nella quotidianit ,semplicemente incredibile,"5,0",0.25,Good
alexa,  diventata la mia aiutante in casa  lista spesa  appunti  timer  sveglia musica  ecc  non potr  pi  farne a meno   ,"5,0",-0.0684,Bad
tutto ok,tutto ok,"5,0",0.148,Good
utile,  bello averlo in casa  bello averlo in casa,"5,0",0.25,Good
audio perfetto,avevo il modello precedente  questo qui naturalmente   ancora meglio,"5,0",0.25,Good
lo consiglio,ok,"5,0",0.1684,Good
utile,buon promemoria per spese sveglie e compleanni,"5,0",0.25,Good
prodotto come da descrizione,niente da dire     spedizione prime superveloce,"4,0",-0.1335,Bad
alexa,facile da usare lo uso tanto per la musica e soprattutto per chiedere tante cose e sapere notizie veloci,"4,0",0.25,Good
echo dot   senza orologio,il prodotto   ottimo  facile installazione  risponde bene ai comandi  ottimo suono  unica nota negativa  e per questo non ho dato   stelle  il cavo di alimentazione   bianco ma con un echo dot nero antracite   se io lo volevo nero era per un motivo quindi anche il cavo doveva essere nero  stesso problema con echo show    sinceramente non ho capito questa filosofia  peccato sarebbe stato perfetto,"4,0",0.25,Good
ottimo,molto bello    arrivato il giorno dopo dell ordine in ottime condizioni ho avuto qualche difficolt  nel configurarlo  comunque funziona bene,"4,0",0.25,Good
ottimo,  il secondo che acquisto ed   davvero comodissimo  soprattutto abbinato alle smart plugs le caratteristiche sono spiegate ottimamente quindi non sto a ripeterleconsigliato,"5,0",0.2108,Good
un apparecchio che ti tiene compagnia,ottimo prodotto  i miei nipoti lo usano spesso,"5,0",0.25,Good
una netta differenza rispetto alle generazioni precedenti,lo ho comprato per sostituire il primo echo dot che avevo acquistato  che cominciava a non funzionare pi  tanto bene  non mi aspettavo una qualit  del suono cos  diversa  si sente che l altoparlante   di un livello superiore  penso che pian piano li sostituir  tutti,"5,0",0.25,Good
qualit  garantita amazon,il prodotto ha tutte le funzionalit  per cui   noto ed esegue in modo eccellente il suo compito la qualit  audio   pi  che soddisfacente e il design   accattivante l installazione   molto semplice anche per gli utenti pi  inesperti grazie per aver letto la mia recensione ,"5,0",0.0384,Good
compagnia,semplicit  nel suo uso e versalita ,"5,0",0.25,Good
buono  ottimi i materiali,ottimo strumento  molto utile,"5,0",0.25,Good
funziona benissimo   non posso farne a meno,alexa   insostituibile  mi trovo benissimo  qualit  suono ottima   veloce nella ricerca   facile da configurare  ,"5,0",0.25,Good
onnisciente,ottimo prodotto di facile installazione  risponde a qualsiasi domanda ed ha un infinit  di applicazioni che io  per manifesta incapacit   ancora non utilizzo ma piano piano         ,"5,0",0.186,Good
top ,amazon echo   personalmente   il primo dispositivo  che acquisto e devo dire che sono molto soddisfatto  indispensabile per chi ama la domotica in  casa e vuole dare un tocco di tecnologia in pi  ,"4,0",-0.1071,Bad
bella,un po  difficile da configurare ma bella,"5,0",-0.173,Bad
alexa,prodotto unico,"5,0",0.25,Good
ottimo,soddisfatto,"5,0",0.25,Good
buono,molto migliorato rispetto ai precedenti,"4,0",0.25,Good
articolo funzionale e buonissimo,articolo comodo e funzionale lo consiglio,"5,0",0.25,Good
may consegna,materiale come ordine  forniture consigliato ,"5,0",0.25,Good
ottimo,grazie amazon prodotto ottimo sonorita ottima,"5,0",0.1212,Good
alexa,alexa e fenomenale ottima,"5,0",0.25,Good
un avventura andata a finire per fortuna benissimo,inizialmente ero moltosoddisfatto ma dopo un mese di utilizzo la cassa ha iniziato a  friggere  rendendo i bassi fastidiosi  il suono era tremolante  l assistenza ha provato a farmi riavviare echodot  ma il problema   rimasto  dopo un passaggio all assistenza specifica e parecchi tentativi hanno scelto di darmi in sostituzione un oggetto ricondizionato  che dopo un mese di utilizzo ha lo stesso problema  a oggi mi   stato cambiato in tempi brevissimi  l assistenza come sempre   imbattibile   mi hanno supportato durante tutta la procedura sostituendolo ora va tutto bene  ps gli altri due che ho acquistato per la casa non hanno quel problema per fortuna ,"5,0",0.344,Good
ottimo ma   ,all inizio avevo messo   stelle  ora ce l ho da qualche mese e abbasso a   perch  ultimamente il comando vocale non funziona sempre benissimo e a volte si scollega dal wifi nonostante la connessione funzioni perfettamente ,"4,0",0.25,Good
prodotto indispensabile,avevo un echo dot di di quarta generazione che ha smesso di funzionare dopo un anno  volevo chiedere ad amazon se si poteva riparare  ma alla fine ho comprato subito questo modello  sperando che duri di pi   una volta abituati ad alexa  non se ne pu  pi  fare a meno ,"5,0",0.2186,Good
ottimo,si sente benissimo    piccolo e si adatta ad ogni stanza  peccato il filo bianco nonostante echodot che ho ordinato io sia nero,"4,0",0.25,Good
amazon,ottima come tutti prodotti amazon secondo me   da migliore il touch per mettere pausa perch  non prende al primo colpo,"5,0",0.089,Good
tutto bene,tutto bene,"5,0",0.25,Good
funziona davvero bene,lo uso per gestire tv android sony  riscaldamento finder bliss  robot deboot ed infuturo per le lampadine  sono pienamente soddisfatto anche perch  avevo l assistente google e trovo che alexa ha una marcia in pi   per esempio ti da la buonanotte con un bacino sonoro parlandoti a bassa voce    la prima volta ho avuto i brividi dalla gioia ,"5,0",0.3408,Good
vale la pena  ,sono passato dalla terza alla quinta generazione e questo   quello che ho riscontrato    audio    a livello audio c   stato un netto miglioramento  il suono   pi  pulito e pi  corposo  ora si pu  godere meglio di una buona musica      funzionalit        le funzionalit  mi sembrano tutto sommato le stesse    stato aggiunto un sensore di temperatura  anche se non mi sembra precisissimo e un sensore di prossimit  per rilevare se c   qualcuno nella stanza   design   il design   molto bello e ben curato  preferisco questo modello fatto a sfera che quello della terza generazione schiacciato si adatta perfettamente in ogni stanza ed oltre ad essere funzionale fa anche da arredo        configurazione       la configurazione   immediata se lo acquistate con l opzione di associarlo direttamente al vostro profilo  una volta tirato fuori dalla scatola basta attaccare l echo alla corrente e si attaccher  automaticamente al wifi e far  da solo tutte le configurazioni se invece   il vostro primo echo basta seguire le istruzioni e in pochi semplici passaggi verrete guidati nella configurazione    considerazioni   vale la pena passare da un precedente modello a questo  io dico dipende  i precedenti modelli non sono cos  inferiori o non gli mancano funzionalit  essenziali da essere sostituiti con questo a priori tuttavia questo prodotto si trova spesso in sconto a circa    euro e per questa cifra mi sento di consigliare il passaggio  altrimenti a prezzo pieno l unica cosa evidente per la quale varrebbe la pena effettuare l upgrade a mio avviso   l audio migliorato consiglio quindi se volete acquistarlo di aspettare una delle tante promo e portarvelo a casa con poco pi  di    euro ,"4,0",-0.0593,Bad
alexa,ottimo,"4,0",0.25,Good
alexa gen   ottimo come gli altri alexa,ho perso il conto di quanti echo dot ho comprato  tutti validissimi ,"5,0",0.25,Good
spettacolo,eco alexa   generazione  ha una qualit  del suono bellissima  ottima ,"5,0",0.186,Good
ottimo,ordinato per un regalo di compleanno ad una carissima amica  ne avevo gi  sentito parlare bene dell echo dot ed   vero    utile e indispensabile da avere in casa  con echo dot puoi fare tutto  ascoltare musica  chiedere ad alexa l ora  il tempo e  di impostare timer o sveglie  sta bene su tutti gli stili di arredamento  consigliatissimo ,"5,0",0.25,Good
ottimo,ottimo prezzo come sempre amazon   il top degli acquisti,"5,0",0.1945,Good
ottimo,ottimo,"5,0",0.25,Good
da avere,non ne faccio pi  a meno,"5,0",0.25,Good
alexa,beh fa quello che deve fare  la musica si sente bene,"4,0",0.25,Good
un ottima  cassa audio,non avendo il wifi a casa e collegando i dispositivi tramite hotspot del mio telefono    stato abbastanza difficile configurare la cassa la prima volta per funzionare solo tramite bluetooth  ma una volta configurata funziona come un orologio casio  perfettamente e senza intoppi  la qualit  del suono a questo prezzo credo che sia imbattibile  il microfono e il software riconoscono benissimo la voce ed   un gran piacere usarla per ascoltare musica e guardare film  ve la consiglio ,"5,0",0.25,Good
per me indispensabile  ,un dispositivo per ogni stanza e non solo  infatti anche in giardino c    alexa   il motivo   semplice  domotica  musica  ricerche  notizie  ricette e quant altro ,"5,0",0.25,Good
ottimo,non era per me ma per un non vedente ho aspettato che lo usasse un po  prima di lasciare feedback  ottimo prodotto veramente soddisfatto dell acquisto ,"5,0",-0.173,Bad
ottimo prodotto,i dot sono sempre un ottimo entry level  non sempre recepisce le domande al primo tentativo ma tutto sommato bene  ottimo audio,"5,0",0.25,Good
molto funzionale   ,non avevo mai provato un oggetto simile  l ho trovato divertente e utile  ci sono diversi giochi che intrattengono i bambini e si possono caricare moltissime skills per comandare i comandi domotici di casa  valuter  l acquisto di un altra alexa,"5,0",0.25,Good
recensione alexa,mi   piaciuto il servizio che offre,"5,0",0.25,Good
