Title,Body,Stars,Polarity,Polarity_Text
qualit  del suono veramente buona,la scorsa estate  durante una super offerta a soli       avevo preso l echo dot   generazione ed ero rimasto piacevolmente stupito della qualit  sonora in considerazione delle sue ridotte dimensioni  tralascio le considerazioni sul mondo alexa di cui molti ed assai pi  competenti di me gi  hanno scritto   a novembre u s  vedo una super offerta a      per il nuovo modello di    generazione con recensioni molto positive circa un ulteriore ed apprezzabile miglioramento del suono   decido che per quella cifra  visto che a volte si sprecano ben pi  soldi per poco pi  di nulla  valeva la pena di acquistarlo cos  li avrei sistemati in ambienti diversi  se la    generazione era gi  buona questo mi stupisce nel confronto  a volte mi chiedo come sia possibile che un aggeggio poco pi  grande di una mela possa avere una tale qualit  sonora  chiaramente la soundbar che ho   un altra cosa  ma parliamo di ben altre dimensioni e prezzi ,"5,0",0.4132,Good
echo dot  gen,prodotto arrivato in tempo con spedizione prime  conforme alla descrizione e alle foto presenti sul sito,"5,0",0.25,Good
utilit ,straordinario   ,"5,0",0.25,Good
 ,buon prodotto,"5,0",0.25,Good
bella comoda,bella comoda,"4,0",0.25,Good
consigliato,facile installazione lo trovo utile  consigliato per il prezzo,"5,0",0.25,Good
pacco arrivato integro e prodotto molto bello,cassa molto potente e compatibile con tutti i telefoni,"4,0",0.25,Good
eco dot,questo apparecchio lo ha voluto comprare mia moglie ovviamente per velocizzare le azioni in casa  diciamo che avendolo utilizzato da diversi giorni ho potuto notare che funziona ma purtroppo non al     per     perch  ad esempio io in casa ho una smartv hisense da    pollici molto recente e con quella non riesco a connettere le funzioni di alexa  anche avendo provato in diversi modi quindi do   stelle perch  purtroppo non si pu  associare a tutte le cose elettroniche che ci sono in casa ma resta utile per altre sue funzioni ,"4,0",-0.0405,Bad
ottimo,al di sopra delle mie aspettative ,"4,0",0.25,Good
top,mi diverto con alexa  applausi per chi lo ha inventato ,"5,0",0.1562,Good
ottimo prodotto,ottimo prodotto,"5,0",0.25,Good
comodo,usata come regalo,"5,0",0.25,Good
alexa,prodotto ottimo   venditore eccellente,"4,0",0.25,Good
ottimo prodotto,ottimo prodotto  acquistato per curiosit   principalmente lo uso come sveglia  devo ancora studiare un po  le funzioni  comunque acquisto consigliato ,"5,0",-0.173,Bad
alexa,si sente bene e forte,"5,0",0.25,Good
mai pi  senza ,da quando ho questo echo dot anche fare bici in casa   diventato pi  divertente lascio accesa la musica per i miei animali domestici quando sono fuori casa  posso cambiare volume e brani tramite il telefono  anche essendo fuori casa  funzione super comoda  a breve acquister  anche le lampadine e videocamere di sorveglianza occupa poco spazio  la musica si sente discretamente e a volume massimo si sente abbastanza alto  i bassi sono da migliorare ma per un altoparlante cos  piccolo non si pu  pretendere  utile anche come sveglia e come promemoria super consigliato ,"5,0",0.3587,Good
must have,avere in casa alexa   una gran comodit  si ascolta musica di ottima qualit  audio  si pu  interagire con l apparecchio per sapere le condizioni meteo piuttosto che le notizie del giorno e tante altre cose non se ne pu  pi  fare a meno ho acquistato con il prezzo in promozione e sono veramente soddisfatta la consegna precisa ,"5,0",-0.1476,Bad
funziona benissimo,ottimo prodotto  funziona bene  e  molto  utile soprattutto per ricordare le scadenze e la lista della spesa ,"5,0",0.25,Good
buono,como per sapere notizie in tempo reale,"4,0",0.25,Good
ottimo prodotto,ottimo prodotto,"5,0",0.25,Good
ottimo prodotto,non credo abbia bisogno di descrizioni alexa ,"5,0",0.25,Good
la nostra alexa,immancabile in casa    di compagnia per le notizie  la musica  i timer  etc ,"4,0",0.25,Good
qualit  e facilit  d uso ,il primo articolo per persone normali  che vogliono affacciarsi alla domotica  cassa audio spettacolare in piccoli ambienti ma si fa sentire anche in ambienti pi  grandi perfetta ,"5,0",0.25,Good
la base per una casa domotica,niente da fare  alexa si dimostra un eccellente assistente vocale l utilizzo dell app alexa sul telefono   un obbligo  ma davvero permette di regolare tutto se avete intenzione di implementarla in casa fidatevi  sar  un extra che si sentir  non appena ci farete un attimo la mano riconosce la voce molto bene anche dalle altre stanze e non fa interferenza se avete alexa su altri dispositivi  capir  in automatico a quale rivolgersi unica pecca che ho trovato  essendo un patito dell audio    che non ha nulla a che vedere con casse bluetooth di fascia media  qualitativamente buona ma non eccellente non comprate alexa per sentire solo la musica ,"5,0",0.186,Good
piccolo     in tutto   ,funzionale elegante occupa poco spazio quindi adattabile ovunque ma le sue dimensioni si rispecchiano anche nella potenza del suono    al massimo volume suona come il mio smartphone quindi se quello che cercate   un device che andrete ad utilizzare sopratutto per ascoltare la musica ovviamente da primemusic vi consiglio la sorella maggiore decisamemte pou potente e con un suono piu uniforme per quanto riguarda il funzionamemto e la qualita ovviamente meriterebbe non   ma   stelle  ,"4,0",0.25,Good
suono buono ma pi  sorda della  ,suono ottimo  l assistente vocale per  risulta pi   sordo  della versione      ,"4,0",0.25,Good
buon prodotto,fa quel che ci si aspetta  poco ingombrante  rapida nelle risposte ,"5,0",0.25,Good
molto migliorato,l ho acquistato per sostituire un echo dot di un paio di anni fa  per capirci quello  piatto  di  a generazione che si trova ancora in vendita la differenza in termini di qualit  audio   notevole e gi  solo questa vale i circa    euro di differenza sul prezzo inoltre questo ha anche il sensore di movimento e dunque consente di creare routine che si attivano quando rileva la presenza di qualcuno nella stanza spettacolare la procedura di installazione azione che consente anche all utente meno esperto di collegarlo praticamente    senza fare niente   spesso chi non lo possiede mi chiede    a che ti serve beh  a tante cose  molte delle quali probabilmente ancora non le conosco    un assistente vocale che mi fa compagnia leggendo i dei libri  ricorda le mie scadenze  mi sveglia al mattino  mi dice le news e le previsoni del meteo  mi collega con altri dispositivi simili per parlare con i miei familiari  oltre ad essere un ottimo speaker per ascolto radio o playlist  consente di gestire l accensione e spegnimento delle luci e di tutti i dispositivi controllabili via bluetooth o wi fi come le tapparelle  le telecamere di sorveglianza  le luci dell albero di natale    insomma  tutto ci  che   compatibile con alexa si pu  gestire attraverso questo piccola sfera magica lo consiglio dunque a chiunque voglia divertirsi con la domotica e l automazione dei vari dispositivi elettronici di casa certo  una volta facevamo tutto anche senza ma    non   un buon motivo per non provare la differenza  soprattutto quando ci semplifica la vita  ,"5,0",0.0809,Good
soddisfatto,semplice e facile da installare,"5,0",0.25,Good
niente,per adesso solo musica,"5,0",0.25,Good
bellissimo,tutto bene grazie,"5,0",0.25,Good
non so,funziona come tutte,"5,0",0.25,Good
alexa,tutto ok  ottimo prodotto,"5,0",0.1684,Good
comodit ,alexa ottima compagna giornaliera  si sente benissimo e sempre pronta rispondere a qualunque esigenza ,"5,0",0.25,Good
capisce,lo preso per mia figlia e si capiscono benissimo sodisfatta lei e contento io,"5,0",-0.0684,Bad
un nome  una garanzia ,acquistata con il black friday  installata subito e utilizzata ogni giorno assolutamente consigliata ,"5,0",0.25,Good
echo dot     generazione  modello      ,ottima idea anche per un regalo,"5,0",0.25,Good
stupenda,eccezionale,"5,0",0.25,Good
assistente,ottimo prodotto per l uso in casa per domotica e le sue funzioni,"5,0",0.25,Good
come al solito impeccabile,consegna impeccabile  ormai li sto inserendo in tutta la casa e sono contentissimo del loro funzionamento,"5,0",0.25,Good
ok,ottimo,"5,0",0.2296,Good
bene,li ho provati  tutti     devo dire che alexa soprattutto per il prezzo mi ha stupito  ottimo prodotto  sono soddisfatto,"5,0",-0.0112,Bad
miglioramenti solamente nel design,rispetto al modello precedente di eco dot  quello di terza generazione  personalmente noto solo miglioramenti nel design  la qualit  audio mi sembra la stessa e l efficienza energetica   pressoch  la stessa  mi sono trovato bene in passato  mi trovo bene tutt ora  nulla da aggiungere,"5,0",0.25,Good
eccellente,  il mio secondo per uso personale   facile da avviare e utilizzare  molto utile e funzionale  a tratti sorprendente  l audio non fa miracoli  ma   molto buono ,"5,0",0.25,Good
tutto perfetto,tutto perfetto,"5,0",0.25,Good
l altoparlante perfetto  alexa un po  meno,l altoparlante ha volume  microfono e bassi incredibili  ma alexa all interno non capisce molte delle cose che gli si vengono dette  rispondendo sempre con  non lo so    non ho capito  ecc  anche se migliorabile da amazon  alexa non fornisce una conversazione scorrevole come quella di google assistant  e non supporta delle domande riferite ad altre domande precedenti  per le funzioni dell altoparlante e il prezzo in sconto puo comunque essere una buona offerta ,"4,0",0.1349,Good
tutto ok,tutto ok,"5,0",0.148,Good
molto divertente,ottimo per ascoltare musica e fare domande  oggetto simpatico  non indispensabile per ora ,"5,0",0.25,Good
ottimo suono,possiedo altri dispositivi echo  il suono   decisamente il migliore ,"5,0",0.25,Good
una conferma,ottimo  qualit  della voce migliorata rispetto alla versione  ,"5,0",0.25,Good
utile,a volte non mi sente e devo ripetere le cose due volte nonostante sia a   metri di distanza per  per il resto molto utile  anche se dovrebbero mettere le canzoni gratuitamente invece di avere spotify o amazon music premium  ,"4,0",0.1212,Good
la uso come radio in cucina,cercavo una radio per la cucina che non prenda tanto spazio e facile da usare ma alcune costavano veramente molto     e sono arrivata a alexa faccile da usare non   ingombrante e il prezzo era perfetto la sto utilizzando da   mesi ormai   sono pienamente soddisfatta ,"5,0",0.25,Good
amazon alexa,solo una parola perfetta  non esiste prodotto migliore di questo,"5,0",0.2178,Good
amazon echo dot di  a generazione  un dispositivo promettente  ma non all altezza dei concorrenti,l amazon echo dot di  a generazione   un dispositivo con una grande promessa  ma che non riesce a mantenere tutte le aspettative  sebbene il design compatto e la qualit  audio siano abbastanza buoni  il dispositivo non riesce a distinguersi dai concorrenti sul mercato uno dei principali problemi dell echo dot di  a generazione   la qualit  dell assistente vocale alexa  rispetto ad altri assistenti virtuali come siri di apple e google assistant  alexa sembra meno intuitiva e spesso fatica a capire le richieste degli utenti  inoltre  il dispositivo ha problemi di riconoscimento vocale  specialmente quando si trovano in ambienti rumorosi un altra criticit  riguarda le opzioni di connettivit  limitate  l echo dot di  a generazione ha solo una porta aux in  il che significa che non c   possibilit  di collegarsi via bluetooth  ci  pu  essere un problema per chi utilizza il dispositivo principalmente per ascoltare musica infine  il prezzo dell echo dot di  a generazione   pi  alto rispetto ad altri dispositivi simili sul mercato  senza per  offrire prestazioni superiori  ci sono altre opzioni pi  convenienti che offrono prestazioni simili o migliori in conclusione  l amazon echo dot di  a generazione   un dispositivo promettente  ma che non riesce a distinguersi dai concorrenti sul mercato  la qualit  audio e il design compatto sono abbastanza buoni  ma il dispositivo soffre di problemi di assistente vocale  opzioni di connettivit  limitate e un prezzo pi  alto rispetto ad altri dispositivi simili  con una valutazione di   stelle su    ci sono sicuramente altre opzioni sul mercato da considerare ,"3,0",0.2678,Good
molto utile in tutto  ,molto utile nella vita quotidiana   a volte stonata    ,"5,0",0.25,Good
ottimo prodotto,non risponde ai comandi,"5,0",0.25,Good
top,ne possiedo   collegati sala e camera top,"5,0",0.1012,Good
okkayyy,con srte soldi va anche troppo bene,"5,0",0.25,Good
utile,la uso in ogni circostanza,"5,0",0.25,Good
perfetto,ha un suono perfetto,"5,0",0.186,Good
ottimo prodotto,prodotto super intelligente,"5,0",0.2898,Good
top,fa tutto  o quasi  ,"5,0",0.2202,Good
valido,molto comodo per tante piccole cose  alcune volte non riconosce la voce e altre volte non sente bene  ma prodotto consigliato ,"4,0",0.25,Good
ottimo prodotto,funziona bene,"5,0",0.25,Good
ok,perfetta,"5,0",0.2296,Good
ottimo acquisto,ottimo prodotto,"5,0",0.25,Good
echo dot,ottimo prodotto   ,"5,0",0.25,Good
ottimo come sempre,  gi  il secondo che acquisto ed   tutto impeccabile questo lo regalato alla mia nipotina che ascolta le canzoni     ,"5,0",-0.0684,Bad
perfetto,funziona perfettamente,"5,0",0.25,Good
facile da utilizzare,prodotto come da descrizione,"5,0",0.25,Good
la consiglio,efficace,"5,0",0.25,Good
  il terzo che compro,ormai a casa ne ho tre in varie stanze  questo l ho acquistato a mia madre che lo ama    ascolta musica classica  sente il telegiornale o semplicemente chiede qualcosa quando non sa la risposta  purtroppo non l ho collegato a luci o tv ma gi  utilizzandolo come base    bellissimo  io lo uso anche per addormentarmi o come svegli e come promemoria di farmaci da prendere appena sveglia  acquistatelo e non ve ne pentirete ,"5,0",-0.0684,Bad
troppo utile,discreto ma utilissimo,"5,0",0.25,Good
attenzione  stereo solo con sorgenti amazon,convinto dal buon suono che hanno i due echo che ho gi   e ho prese altre due per creare una coppia di speaker stereo per la tv e per il giradischi  errore  se usati con una sorgente amazon  tipo amazon music sul cellulare  allora funzionano in coppia stereo  ma se cerchi di accoppiarli ad un dispositivo qualsiasi  tipo tv o giradischi o cellulare  ne funziona solo una alla volta  restituisco subito ,"4,0",0.1538,Good
ottimo,tutto ok,"5,0",0.1684,Good
buon prodotto,pensavo avesse un volume migliore rispetto alla versione precedente invece devo dire che sono molto simili  talvolta non sente in maniera perfetta ma per quanto riguarda l assistente vocale la cosa che pi  mi colpisce   la sua costante evoluzione e miglioramento ,"4,0",-0.1335,Bad
ottimo aiuto in casa,una figata mi piace molto e risponde alle attese,"4,0",0.25,Good
la sensibilit ,l utilizzo,"5,0",0.25,Good
una certezza come al solito ,un p  complicata la gestione stereo con il mac  una seccatura che potrebbe essere anche causata dalla mia inesperienza    due echo in stereo via bt non si riesce  in stereo solo su spotify  con applemusic per quanto ci abbia provato sembra non sia possibile  poi in realt  non ho approfondito ,"5,0",-0.0684,Bad
simpatico,ottima esperienza,"5,0",0.25,Good
magica   ,con l abitudine impari ad utilizzarla al meglio    ottima un po  per tutto studio  traduttore  ricette al volo  musica  informazioni varie   stupefacente,"5,0",-0.173,Bad
consigliato,semplice da usare e facile l installazione,"5,0",0.25,Good
ottimo prodotto,ottimo prodotto e ottimo prezzo,"5,0",0.25,Good
divertente ed utile,incuriosita dalle potenzialit  di questo apparecchio  mi sono decisa ad acquistarlo scegliendo la versione pi  economica  proprio per testare se idonea per me arrivata  gi  impostata  in quanto iscritta ad amazon  e  bastato collegarla alla corrente perch  fosse pronta all uso  a qualche giorno dal suo utilizzo  posso dire che mi piace molto  sono contenta e cercher  di scoprirla giorno dopo giorno  oltre alla possibilit  di sveglia  musica  rubrica dove annotare a voce appuntamenti  cose mancanti ecc ecc  da anche risposte su quesiti  inoltre ci si pu  anche divertite giocando con lei  uniche pecche antipatiche   la frequenza nel proporre acquisti di skill   tipo di app idonee per alexa  e spesso la non comprensione su una domanda posta  con conseguente risposta inadeguata   essendo un prodotto di amazon tendenzialmente cerca di proporre acquisti  onde evitare di acquistare con un involontario consenso  basta disattivare gli acquisti vocali nell apposita sezione  nel complesso gran bel giocattolino per gli appassionati delle novit   assolutamente da regalare o regalarsi  io la ricomprerei al volo    ,"5,0",-0.1108,Bad
tutto come previsto,nulla da segnalare    arrivato ci  che mi aspettavo,"5,0",0.25,Good
una garanzia,pratico e maneggevole,"5,0",0.25,Good
design e funzionalita,ottimo oggetto tecnologico e sound accettabile per musica   comandi semplici  skills facili ed intuitive,"5,0",0.25,Good
velocit  consegna,perfetto,"5,0",0.25,Good
un passo avanti,rispetto alla terza generazione un grosso passo avanti sia per riconoscimento che per acustica,"5,0",0.25,Good
tutto ok,tutto ok,"5,0",0.148,Good
bellissima  solo una pecca ,bellissima   l unica pecca   che il cavo sia bianco esteticamente era perfetto nero  ,"5,0",0.25,Good
echo,ogni tanto si incanta ma ho notato che lo fa quando attivo le restrizioni sulla voce nella privacy da app   trovo comodo il pulsante blocco delle registrazioni audio non mi piace che le mie conversazioni possano essere ascoltate da terzi e messe sul cloud internet  non mi fido  per il resto audio si sente molto bene  contento perch  lo ho acquistato a met  prezzo in promozione ,"4,0",0.25,Good
essenziale al giorno d oggi,chi non ha un alexa in casa  beh io fino ad ora non l avevo e posso dire che mi ha rivoluzionato la casa dalla luce all accensione della tv  molto utile anche per le notizie mattutine  non si pu  fare a meno,"5,0",0.0191,Good
alexa,ho deciso di acquistare questo dispositivo in quanto quello precedente si   rotto  rispetto al classico alexa pi  piccolo questa palla risulta maggiormente performante a livello di suono  ma non ho notato altri grandi differenza  la differenza di prezzo  comunque    contenuta ,"5,0",0.25,Good
perfetto per regalo,funziona,"5,0",0.25,Good
trasmissione dati,utile simpatico prodotto incredibile,"5,0",0.25,Good
super,facile e comoda,"4,0",0.2599,Good
ottimo prodotto,buon venditore   ottimo rapporto qualit  prezzo,"5,0",0.25,Good
funziona benissimo e si attiva molto rapidamente,io cercavo uno di quegli apparati alexa  che non sembrano pi  disponibili   come anche quelli di altre marche   non sempre compatibili   ho ho ripiegato su questa e sono pienamente soddisfatto della scelta,"5,0",0.25,Good
ottimo prodotto,prodotto eccellente  utile ,"5,0",0.25,Good
buon acquisto,buon venditore,"4,0",0.25,Good
regalata a mia suocera,regalata a mia suocera che ora si diverte con musica e altre funzionalit   unica nota negativa   che se non hai music unlimited f  come gli pare e ti riproduce una canzone di quel cantante e    di altri  per il resto   di compagnia e rende un po pi  agibili alcune azioni   timer   promemoria   calcolatrice   ricerche veloci ecc    ,"4,0",-0.3097,Bad
ineccepibile,nulla da dire  ottima segretaria per la gestione degli appuntamenti e dei propmemoria,"5,0",-0.1335,Bad
consigliata,un dispositivo che ti permette di rilassarti ascoltando musica con grande semplicit ,"5,0",0.25,Good
top,ottima,"5,0",0.2202,Good
simpatico accessorio ,  il secondo apparecchio di questo tipo che acquisto  questo per un amica      che dire    un simpatico accessorio dalle molteplici funzioni anche molto utili  consigliato ,"5,0",-0.1335,Bad
adoro la mia alexa,adorabile,"5,0",0.1704,Good
ottima,appena comprata e sono rimasto soddisfatto,"5,0",0.25,Good
un ottimo giocattolo,devo dire che sono rimasto molto sorpreso dalla facilit  con cui riconosce i dispositivi  ho provato anche con  tasmota ed   immediato  la parte audio   molto buona ma inferiore all echo  forse anche per la dimensione inferiore di questo dispositivo  echo   pi  grande ed immagino le casse siano pi  prestanti  fastidioso il fatto che se si chiedono brani di uno specifico cantante  comunque riproduce canzoni di vari artisti  amazon vuole costringerci ad aderire ad amazon music a tutti i costi  di fatto siamo gi  suoi clienti  magari anche prime e comunque alimentiamo amazon gi  con i nostri acquisti  potrebbe essere pi  comprensiva  nel complesso sono molto soddisfatto ,"5,0",0.0603,Good
ottimo prodotto     con lode,direi tutto ok,"5,0",0.1684,Good
non c   niente da dire ,ottimo mezzo polifunzionale,"5,0",0.1541,Good
manca poco per averle ovunque,dunque  questa   stata destinata in camera dei ragazzi  cos  che loro ascoltino la loro musica e noi la nostra  ovviamente comoda per ricerche vocali ogni tanto s impappina o parte per la tangente spiegando cose non richieste  ma la valutazione rimane sempre positiva ,"5,0",0.25,Good
echo dot     generazione  modello      ,funziona bene  e si sente anche bene radio musica ecc   pensavo peggio   x le dimensioni che ha  ,"5,0",0.186,Good
velocit  estrema,tecnologia avanzata ottimo acquisto,"5,0",0.25,Good
estetica e installazione,il suono   buono  l installazione non   stata semplicissima  occorre scaricare sul cellulare l app e comunque ho dovuto chiedere assistenza telefonica che comunque ha risolto il problema subito  dal punto di vista estetico per me non    eccellente   inoltre il dot    nero      ma il cavi di alimentazione nella mia confezione   bianco  non so se per errore       non    il massimo   ,"4,0",0.0706,Good
il mio primo dispositivo eco,premetto di averlo sempre considerato un oggetto superfluo  erroneamente  infatti  dopo meno di un mese di utilizzo  non voglio dire mi sia indispensabile ma senza dubbio mi   di grande aiuto nella quotidianit   ti libera letteralmente le mani  notifiche su consegne spedizioni  news  promemoria  palinsesto tv meteo e tante altre funzioni sono a portata di voce e quando ad esempio sto cucinando oppure con le mani impegnate   davvero comodo e funzionale  personalmente ci ascolto la musica per ore e reputo l audio di ottimo livello    come avere un enciclopedia sempre aperta a disposizione  non posso pi  farne a meno ,"5,0",-0.1335,Bad
fa quello che puo,pensavo fosse migliore  ma   molto limitata,"4,0",0.25,Good
alexa   fantastica ,un ottima assistente,"5,0",0.25,Good
meraviglioso,e supercomodo lo uso per tante cose e il mio assistente a casa,"5,0",0.25,Good
innamorato,in casa adesso gira in altra aria   puoi chiedere tutto quello che vuoi e alexa ti risponder  sempre,"4,0",0.25,Good
bello  utile ,intuitivo  utile per la musica e per quello che pi  serve ,"5,0",0.25,Good
un amica geniale,ho preso finalmente il dispositivo echo dot di amazon che nel corso degli anni   entrato piano piano nelle case di milioni di italiani  avendo il piacere di conoscere l assistente per eccellenza ovvero alexa  devo dire che il prodotto   molto facile da installare e sopratutto molto compatto ma dalla grande potenza sonora proveniente dallo speaker interno  ho preso il modello bianco ghiaccio che si sposa benissimo all arredamento del mio salone prevalentemente color bianco e nero  un prezzo super conveniente durante la settimana del black friday ha fugato ogni mio dubbio sull acquisto che ponderavo da quasi un anno  sinceramente non vale la pena comprarlo a prezzo pieno  il prezzo   abbastanza alto visto che   l ultimo modello generazionale  ma durante il periodo in cui amazon lo propone in sconto vi consiglio di comprarlo senza pensarci due volte  la sera mi rilasso ascoltando della buona musica jazz e blues senza dover mettere dischi o fare altro  basta solo un comando con la voce e il gioco   fatto ,"5,0",0.3263,Good
perfetto ,l ho posizionato in bagno ed   fantastico ,"5,0",0.0911,Good
ottimo regalo,regalato a mio zio  non proprio avvezzo alla tecnologia   sinceramente ha gradito molto pi  di quanto immaginassi gliel ho preso perch  a lui piace sapere il tempo  la temperatura  gli torna utile come timer  come promemoria  pu  mettere la musica   senza smanettare con il cellulare ormai hanno fatto amicizia  e risponde anche se la chiama alessia  alexia e simili xd ma se non erro gli si pu  impostare un altro nome  ma mi fanno troppo divertire le sue varianti secondo me   un ottima idea anche per i nonni  che hanno internet a casa ovviamente    cos  mettono la musica che piace a loro  sanno sempre che ore sono  se piover    ricette  pu  chiamare persone direttamente dal dispostivo  purch  anche i destinatari abbiano impostato l app alexa se non erro    non pensavo  ma sono rimasta davvero contenta  pi  di quello che pensavo ,"5,0",0.1405,Good
un simpatico prodotto,al momento quasi tutto perfetto  l unico limite   che alcune risposte non le conosce oppure spesso mi collegherebbe in automatico ai pacchetti musica e libri a pagamento di amazon  per il resto un simpatico prodotto   soldi ben spesi ma l ho preso in offerta  a prezzo pieno ci avrei pensato forse ,"4,0",0.1212,Good
echo dot    generazione,tutto ok   stato un regalo che hanno apprezzato tantissimo  funziona perfettamente ed   facile da installare amazon top come al solito consegna in un giorno ,"5,0",0.2788,Good
consigliata io l ho presa per ascoltare musica di qualsiasi genere,consigliata per ascoltare musica di ogni genere,"5,0",0.25,Good
pensavo meglio,rispetto alla  a generazione si sente decisamente meglio  suoni pi  cristallini e forti  ma sempre rispetto alla  a mi capita pi  spesso di dover ripetere le cose e dove chiamare pi  volte alexa  quindi canta bene ma   un po  sorda ,"4,0",-0.173,Bad
