Title,Body,Stars,Polarity,Polarity_Text
eco doth   colore nero,  stata una sorpresa  non mi interessava pi  di tanto il prodotto  ma per risolvere alcuni problemi all impianto elettrico  mancanza di spazio nei corrugati per far passare tutti i cavi dei deviatori  ho deciso di prenderlo e iniziare a domotizzare le luci  qui la sorpresa  oltre a domittazere ho scoperto un altoparlante dal suono potente e pulito  si connette in automatico con spotify e amazon music  adesso cercher  di accoppiarlo ad un lettore mp  per le mie discografie  tanto ne sono rimasto soddisfatto anche per la possibilit  di usarlo come interfono  che ho deciso di prendere anche un echo show da     ed   formidabile pensare che io possa controllare cosa succede nella stanza dove l ho messo  chiaramente all ingresso  ,"5,0",0.1212,Good
perfetto,facile installazioneaudio perfettotutto come da descrizione,"5,0",0.25,Good
buona,ch  dire come cassa   buona anche il prezzo per  diciamo che delle volte alexa sbaglia quello che dici comunque la consiglio tutti grazie come sempre amazon   il venditore saluti,"4,0",-0.0773,Bad
da migliorare,il prodotto di per se   valido  buona la qualit  del suono  tuttavia abbinandolo ad una fire tv c   un enorme differenza di volume tra l assistente vocale e i contenuti visualizzatore  prime video  netflix   in particolare per godere dell audio dei film e serie sono costretto a metterlo quasi al massimo  e se nel mentre necessito di alexa devo prima abbassare il volume altrimenti spara al massimo ,"4,0",-0.086,Bad
utilissima ed apprezzata come regalo,prodotto comprato in occasione di natale ed   stato molto apprezzato echo dot   ha una bella linea che si rapporta in maniera ottimale con l ambiente circostante l audio durante la riproduzione della musica   limpido e si riescono a percepire i bassi in modo equilibrato comodissimo anche il termostato integrato che rileva  la temperatura interna alla stanza da sottolineare anche l ottima interfaccia del sistema che lo rende migliore dei competitors prodotto consigliato sia agli amanti della tecnologia che vogliono rendere la loro casa dotata di una domotica intelligente  sia a chi vuole semplicemente un assistente virtuale ,"5,0",0.186,Good
alexa tutta la vita,ottimo acquisto,"5,0",0.25,Good
alexsa e molto utile,e un regalo che io ho fatto per natale funziona bene il pacchetto ben fatto e arrivato il giorno dopo con prime,"5,0",0.25,Good
suona molto bene,perfetto  buona qualit  del sound  ma devo ancora scoprire come collegare tramite il bluetooth  la mia smart tv     sempre che sia possibile farlo  per  acquistato a met  prezzo con il black friday  un bell affare    cinque stelle ,"5,0",0.1012,Good
molto professionale,forteeeeeeee,"5,0",0.25,Good
ottimo,ottimo prodotto,"5,0",0.25,Good
purtroppo mi   arrivato difettoso,purtroppo il prodotto mi   arrivato difettoso  infatti non c era modo di fari ascoltare a meno dell attivazione da tastierino  fatto il reso e preso il modello con la scritta per pochi euro di differenza e devo dire la verit    davvero comodo il piccolo display sia per timer che come orologio ma anche nel resto delle comunicazioni  consiglio l altro modello a questo per una questione di comodit  ma alla fine   lo stesso prodotto ,"3,0",-0.0684,Bad
utile ,posizionato in cucina  utile per sveglie timer e promemoria  musica e radio con semplice richiesta vocale  arricchito con tanti giochi da poter fare  da migliorare in futuro l intelligenza di alexa e aggiungerei anche una cassa pi  forte   ,"4,0",0.25,Good
ottimo suono rispetto all echo dot base,sono contento che abbiano migliorato il microfono  adesso anche a due stanze di distanza riesce ad ascoltare  inoltre mi   capitato di parlare nominando  alexa  in un discorso con altre persone e non si   attivata  forse un aggiornamento fa riconoscere finalmente quando   il momento di attivarsi e quando no  comunque funziona in modo egregio con tutte le funzioni di alexa ,"4,0",-0.0684,Bad
ottimo prodotto,mi   piaciuto molto la qualit  e il disegno,"5,0",0.25,Good
buon prodotto,utile per tutto ,"5,0",0.25,Good
ottimo per tante cose musica news comandi vocali ecc top,ottima qualit  del suono riconoscimento vocale ok puoi chiedergli quasi tutto ,"5,0",0.1386,Good
ottimo,prodotto conforme alla descrizione e funzionale  il suono   migliorato,"5,0",0.25,Good
ok,ok,"5,0",0.148,Good
mah   ,audio migliorato ma dopo averlo provato per un mese sono tornato alla versione   che a mio parere rimane il migliore di tutti  quando faccio le chiamate ad altri dispositivi non mi sentono con la versione   mi sentono forte e chiaro  quindi microfono da migliorare insieme al riconoscimento vocale  ,"4,0",0.25,Good
comodissima,ottimo rapporto qualit  prezzo  non molto complicata da installare ma non semplicissima da configurare con le skill che non sono sempre presenti nella lista che trovate nella sua app  non   sempre chiaro il procedimento  comunque un accessorio comodo ,"4,0",0.25,Good
echo ed alexa al top,nella vostra camera da letto non pu  mancare questo accessorio essenziale per la domotica ,"4,0",-0.0891,Bad
buono,mi aspettavo un audio migliore ma va bene cos      un buon prodotto ,"4,0",0.25,Good
echo che echo,funziona veramente      umor  sono capricci utili soprattutto per i bambini  non mi voglio prolungare pi  di tanto l importante avere tutto wifi poi con echo puoi fare quello che vuoi facile nel montaggio  installazione idem  consiglio vivamente amazon se consiglia ci sar  un motivo ,"5,0",0.1212,Good
un assistente vocale ma non solo,ho acquistato alexa come regalo di natale per mia madre perch  ama molto ascoltare musica e perch  vedo che spesso guarda le ricette su youtube  quindi per permetterle di azionare musica o tv senza dover usare un telecomando  in realt  ho scoperto tutte le funzioni legate alla casa intelligente come l accensione di luci o il collegamento di dispositivi  e mi sto appassionando  credo che nel tempo implementer  ulteriormente quest automazione domestica con alexa ,"5,0",-0.0684,Bad
da consigliare,prodotto molto semplice da usare,"5,0",0.25,Good
casa,mi   piaciuto tantissimo e un  altoparlante ottimo  di alta qualit   lo consiglio  lo utilizzo  per comandare  tutto la casa  ,"5,0",0.25,Good
utile,ottimo suono   utile,"4,0",0.25,Good
alexa,alexa una garanzia,"5,0",0.25,Good
ottimo,da scoprire le funzionalit  del dispositivo,"4,0",0.25,Good
ottimo,bella e funzionale,"5,0",0.25,Good
ottimo passatempo,facile l istallazione e comoda,"5,0",0.25,Good
bellissimo   lo consiglio grazie,allora amici che dire di echo dot   non mi aspettavo che questo oggetto trasformasse la mia vita ho iniziato   con un pezzo alexa appunto e ho trasformato a oggi la mia casa tutta smart  dalla tv a tutti gli oggetti smart che ci sono su amazon diriggo il tutto semplicemente seduto sul divano oppure in cucina fantastico lo consiglio ps l unica cosa che non va e  chiedere a alexa di svegliarmi tre volte la settimana per andare ha correre alle   del mattino  perche  e troppo precisa e se non ti svegli insiste ha chiamarti ahahaha ,"5,0",0.2898,Good
  gi  il secondo,acquistato per avere la musica multi stanza  ho provato a metterlo come audio stereo per il televisore ed   stata veramente una scoperta i due canali restituiscono un audio potente per piccoli ambienti,"5,0",0.25,Good
un buon prodotto per la sua fascia di prezzo,la qualit  dell audio non   male ma si potrebbe fare di meglio  la regolazione del volume tramite i tasti a volte ha una risposta non immediata  ma   piccolo e pratico da spostare  noi lo usiamo in sala e in giardino principalmente per ascoltare musica e portarlo avanti e indietro   pratico  purtroppo va necessariamente collegato alla corrente e non dispone di autonomia,"4,0",0.186,Good
ottimo prodotto,ottimo prodotto,"4,0",0.25,Good
ottimo,funziona benissimo,"5,0",0.25,Good
alexa,buon prodotto,"4,0",0.25,Good
bello esteticamente e funzionale  nel complesso un buon prodotto,ormai gli echo dot non sono pi  una novit   ottimo prodotto come gli altri delle precedenti generazioni del resto  ne ho altri    anche di prima generazione  in questo mi aspettavo qualche miglioria evidente ed invece  pi  o meno  siamo sul solito livello anche come qualit  audio ,"4,0",0.25,Good
divertente,ottima compagnia e molto utile per ogni curiosit   sostituisce anche il classico stereo ,"5,0",0.25,Good
amico indispensabile,rapida installazione  mille risorse per tutta la famiglia,"5,0",0.25,Good
soddisfatto  buon prodotto ,prodotto che oramai si recensisce da solo  essendo della famiglia  alexa   a livello di audio mi sembra appena poco pi  basso dei un echo dot  ma sicuramente resta un ottimo prodotto  avrei messo i comandi touch pi  verso l utente e meno verso il lato nel quale si inserisce l alimentazione,"4,0",0.25,Good
audio pi  potente e nuovi sensori,                    impossibile caricare il contenuto multimediale                  il progresso continua   in primis spicca la presenza di un sensore temperatura che rende questo dispositivo un preciso  termometro   altra integrazione riguarda l accelerometro cos  vi baster  toccare il dispositivo per ad esempio mettere in pausa o stoppare la svegliadriver pi  grande e la differenza si notaaudio abbastanza potente e soprattutto realmente personalizzabile nell equalizzazione  modificando dall app le frequenze andrete realmente a percepire le differenze   suono corposo e abbastanza potentefunzione di risparmio energetico   anche la scheda per la connessione wi fi   di ultima generazione consentendo un maggior risparmio energeticoconnettivit  bluetooth da e verso altri dispositivo stabile che vi permetter  di connettere il dispositivo ad altre periferiche mandando o ricevendo l audio    stato rimosso l uscita jack via cavoinstallazione immediata se scegliete l autoconfigurazione in fase d acquisto o anche altrettanto rapida se configurerete tramite app vi baster  sincronizzare e inserire la vostra password wi fimicrofoni bidirezionali sensibili   daranno la possibilit  di azionare comandi di qualsiasi genere dalle ricerche web a l azionamenti di elettrodomestici presenti in casa e associabili all account  ormai quasi tutti gli elettrodomestici dalle tv alle lavatrici o aspirapolveri di ultima generazione sono associabili a questo dispositivoforma e design gradevoli e abbinabili su qualsiasi arredo,"5,0",0.25,Good
prodotto amazon  molto  carino,la forma   molto carina   una sfera con la base che s illumina   con bei colori   utili a capire lo stato della sfera   il volume massimo andrebbe migliorato   l ho comprato perch  enfatizzavano nella caratteristiche il suono     l  app per gestirlo andrebbe semplificata   io ho l account prime e mi era arrivata una mail in cui si diceva che potevo ascoltare liberamente la musica   ma non mi fa scegliere i brani   me li mette simili  l interfaccia dell app alexa crea confusione   bisogna schematizzarla meglio,"4,0",0.2178,Good
difficolt  nella connessione bluetooth non ha uscita aux,                    impossibile caricare il contenuto multimediale                  ho la prima versione di alexa e si connette benissimo alla sound bar lg  questa ultima versione di    generazione non la rileva neanche con la app alexa successivamente ho provato a collegare un alexa di   generazione e si   collegata all istante  nel frattempo mi ha scritto l assistenza di amazon ed ho riprovato a riavviare alexa e si   collegata  nel primo collegamento ha fatto un aggiornamento software probabilmente era necessario riavviare alexa  do   stelle perch  le versioni precedenti hanno l uscita aux   in questa il cavo di collegamento   bianco con alexa nera  ,"4,0",0.3022,Good
strumento carino e comodo,ero un po  perplesso  ma riconosco che sia comodo,"4,0",-0.173,Bad
ottimo sound,buona integrazione con la voce e ottimo sound  scontato   un affarone  ,"4,0",0.25,Good
grande speaker,la base per una casa domotica,"5,0",0.25,Good
bello,troppo carino x ascoltare musica e chiedere informazioni s nza usare il tel   ottimo,"4,0",0.25,Good
ci vuole prime music,per essere cos  piccolo si sente benissimo,"5,0",0.25,Good
prodotto buono,per chi conosce gia questo prodotto non ha bisogno di presentazioni  comodo il sensore per spegnere la sveglia o la musica al tocco ,"5,0",0.186,Good
ottimo prodotto,prodotto ottimo come da descrizione,"5,0",0.25,Good
bello,alexa   stratosferica  risponde bene ad ogni comando  molto comodo e utile per chi sta sempre a letto e per chi perde il telecomando,"5,0",0.25,Good
ottima,tutto bene si sente ottimamente fa tante cose   intuitiva e cosa importante si collega anche con l hotspot dello smartphone ,"5,0",0.25,Good
fantastica,alexa meravigliosa mi ricorda appuntamenti mi fa lista della spesa mi d  il buongiorno  qualit  della musica molto buona,"5,0",0.25,Good
buono,buona,"5,0",0.25,Good
comodo e utile,bell acquisto,"5,0",0.25,Good
un cult,sempre utile,"5,0",0.25,Good
echo dott,mi diverto molto con alexa  con prime tutto arriva in fretta ,"5,0",0.25,Good
buon sound  temperature rilevata imprecisa,un discreto passo avanti dal    anche se niente di esoterico  l avevo preso pi  che altro per sfruttare anche il sensore di temperatura  ma   decismente inaffidabile  anche due echo   vicini segnano   gradi di differenza    mica pochi udpate i sensori dei due echo ora sono in linea sia tra loro che col termostato di casa,"4,0",0.25,Good
regalo perfetto    ,davvero divertente e facile da usare  comoda per le attivit  di tutti i giorni all interno della vostra abitazione ne ho acquistate due   una come regalo per mio padre e devo dire che si possono fare davvero tante cose  utili per controllare prodotti smart home e divertente nella personalizzazione e nell ascolto della musica che preferiamo consigliato   ,"4,0",0.0191,Good
buono,buono,"5,0",0.25,Good
semplice e molto utile,gli chiedi di tutto  dalle notizie alle curiosit    persino le barzellette  si collega con tutte le radio del mondo  utile per le lingue  utile per la scuola dei ragazzi e per cultura generale  un accesso vocale alla rete  simpatica la funzione di messaggi preimpostati a certe ore  ad esempio per ricordarti di una medicina o di fare sport o di bere pi  spesso  si pu  adattare come un amico che ti ricorda le cose importanti   trovo che sia un bel oggetto anche per persone anziane sole  ottimo rapporto qualit  prezzo ,"5,0",-0.0593,Bad
funzionale,un po tanti difetti ,"4,0",-0.173,Bad
regalo perfetto,ne ho prese tre in breve periodo  regalate e tutti soddisfatti ,"5,0",0.25,Good
perfetta,super utile veramente ok vale la pena,"5,0",0.3408,Good
alexa,ottimo prodotto  alexa   una compagna veramente eccezionale  echo dot di    generazione affidabile e si sente benissimo  ottimo acquisto,"5,0",0.25,Good
se potete fatevi un regalo,si pu  sicuramente vivere anche senza  ma se vi capita di trovarla a met  prezzo  allora   un vero affare  fatevi un regalo,"5,0",-0.0593,Bad
utile,bella  mia mamma la adora,"4,0",-0.0684,Bad
ottimo ,senza alexa a casa non possiamo pi  stare      di famiglia ormai  presa in offerta ottimo affare ,"5,0",0.25,Good
amazon    amazon    ,presa cos   singolarmente   totalmente inutile per chi la compra e quindi per quanto poco costi costa sempre troppo utilissima per  per amazon che tramite la  pallina  invoglier  l utente ad acquistare servizi aggiuntivi ad esempio suona quello che vuole lei  impossibile chiedere una canzone  un cd  anche solo canzoni varie di un interprete     puoi scegliere soltanto il genere ed anche su quello    ma se fai l abbonamento la musica cambia    carente anche come possibilit  di configurazione  anche funzioni basilari  ad esempio c   il timer  utile per le uova sode   ma ti becchi la suoneria che vogliono loro smetti di suonare quando esco e riprendi quando rientro     visto il microfono sembre attivo non dovrebbe poi essere cos  difficile chiamate vocali tra vari utenti di icloud  apple  esistono da sempre ed anche amazon avrebbe il suo cloud  basterebbe copiare    non dubito che creando un ecosistema amazon la cosa possa migliorare e molto ma allora diventa impegnativo e non solo a livello economico ,"3,0",0.2247,Good
molto utile e divertente,perfetto  come in descrizione durante l acquisto molto utile e divertente  associata a lampadina e led per le camere  ottima,"5,0",0.25,Good
ottimo prodotto   ,ottimo prodotto   molto efficiente   e molto utile in campo  appuntamenti     lista spesa   timer      lode  ,"5,0",0.25,Good
ormai mi aiuta in tutto,sveglie  promemoria  ricette  timer  comandi tramite prese apposite  insomma una comodit  assurda  straconsiglio,"5,0",0.25,Good
una costante nella qualit  echo dot    ,affidabilit  confermata nel tempo  una costante di qualit   nel mio caso una aggiunta all echo dot che ho nel mio appartamento  di facile abbinamento     e quindi di massima compatibilit  con quanto gi  presente ed abbinato    grande prodotto   ,"5,0",0.25,Good
semplicemente strepitosa,sbalorditivo  nulla da aggiungere,"5,0",0.25,Good
benissimo,  sempre perfetta  ne ho    peccato ogni tanto si perda dei comandi     migliorer ,"5,0",0.25,Good
fa  il suo,come da titolo  fa  il suo  nota negativa  non apprezzo invece l automatismo con cui il sistema  a seguito di richieste musicali  richieda il consenso a sottoscrivere attivazione upgrade e relativi periodi di prova ,"4,0",0.25,Good
regalo,bellissimo colore,"5,0",0.25,Good
ottimo assistente di casa domotica,prodotto buono anche il mio uso   prettamente per la domotica ,"5,0",0.25,Good
ottimo e semplice da usare e utile ,questo   il secondo che ho acquistato  oltre alle funzioni per accendere luci  attivare tramite comandi vocali elettrodomestici collegati ad una presa  ho insegnato alle mie nipotine di   anni ad utilizzare alexa per telefonare a noi tutti della famiglia senza utilizzare nessun telefono  una volta sincronizzata la rubrica dei contatti tramite l app di alexa installata sul telefono di famiglia ,"5,0",0.25,Good
utile e funzionale,facile da usare e divertene  utile per alcune routine ,"5,0",0.25,Good
inimitabile,bello  piccolo e potente  utile e versatile  ti fa anche compagnia,"5,0",0.25,Good
carina,audio buono  e anche utile nel utilizzo quotidiano  ,"5,0",0.25,Good
soddisfatto,articolo consegnato nei tempi e rispondente alla descrizione,"4,0",0.25,Good
fantastico,che dire  semplicemente perfetto  in questo ultimo modello hanno notevolmente migliorato la qualit  audio  in un mese non mi si   disconnesso praticamente mai ,"5,0",-0.1733,Bad
ho qualche dubbio ,acquistato durante il periodo black friday  il prezzo molto basso e quindi conveniente  ma al collegamento ho avuto dei problemi  e tutt ora l app alexa non si comporta come lo faceva con il primo echo dot  ci   voluto un bel po  per calibrare la temperatura  per il resto tutto ok  spero solo non mi sia stato inviato un prodotto usato ,"4,0",-0.086,Bad
fantastico,dispositivo veloce  utile e ormai indispensabilel ho abbinato alle luci che si possono controllare con alexa e il risultato   ottimo,"5,0",0.2103,Good
semplicemente alexa,ecco  ovviamente la prima cosa che volevo fare   proprio cambiare il nome  lo renderanno mai possibile  ma per il resto fa quello che deve fare  qualit  del suono e del microfono pi  che soddisfacenti  lo comando da una stanza all altra senza problemi e senza urlare    ,"5,0",0.25,Good
problematica nell installazione,dopo non poche peripezie ero quasi tentato a rendere il prodotto    poi azzerato cio  disinstallato pi  volteora sembra funzionare    ,"5,0",0.25,Good
alexa,tiene compagnia con la musica che vuoi,"5,0",0.25,Good
comodo,direi che   un acquisto azzeccato   anche se mi prendo un po  di tempo per una valutazione completa  anche se paragonato con echo dot    generazione  che avevo gi   posso dire la qualit  del suono   sicuramente migliore,"4,0",-0.256,Bad
top,arrivata in un giorno  regalata a un parente per natale    stato un regalo apprezzatissimo  ha acquistato anche le lampadine apposite cos  che la mattina  tramite comando    alexa che le accende  l installazione   semplice e il prezzo competitivo ,"5,0",0.1562,Good
must buy,uso ogni giorno alexa   non c   niente da dire pu  essere utile a tutti se si ha una casa tech,"5,0",-0.1108,Bad
soddisfatto,funziona bene    bella da vedere    ma la comodit  di comandare con la voce diversi device non ha prezzo,"5,0",0.186,Good
ottimo assistente di casa,davvero pratico e funzionale  in pochissimo spazio si ha un ottimo hub interattivo e ottimo audio  innumerevoli funzioni disponibili  le uniche perch  sono gli scenari poco che poco fanno interagire altri prodotti e il sensore di temperatura completamente sballato e non configurabile  speriamo che mettano rimedio,"4,0",0.186,Good
proviamo alexa,ho gi  l assistente virtuale google home mini e mi trovo bene per la domotica della casa  mi sono detto proviamo alexa  be a mio parere   tutto un altro mondo  alexa   molto pi  orientata alla famiglia  con giochetti e altro  poi per chi acquista regolarmente su amazon   possibile stilare la lista della spesa  sia per prodotti alimentari che per tutti i prodotti presenti sullo store amazon ,"5,0",0.186,Good
mi piace,facile da installare  riconosce molto bene la voce  molto carina da usare  mi piace,"5,0",0.25,Good
amissilleb,utileelitu veramenteetnemarev,"5,0",0.25,Good
utile ,per una organizzazione e gestione perfetta in casa  utile come sveglia al mattino  se sussurri  risponde sussurrando ,"5,0",0.25,Good
carino,ottimo rapporto qualit  prezzo  onestamente non ne faccio un grande uso  ma quando serve c   ,"5,0",0.25,Good
suono,ottimo   altoparlante eccezionali,"5,0",0.25,Good
bello,semplice da installare e poi veramente d  un sacco di informazioni,"5,0",0.25,Good
bel prodotto,alexa e un ottimo prodotto  pu  essere usato per intranimento e per molteplici cose,"5,0",-0.0593,Bad
alexa,                    impossibile caricare il contenuto multimediale                  utilissima e un po  irriverente    ,"5,0",-0.173,Bad
funzionale,ha dei bassi ottimi considerando quanto costa io la utilizzo principalmente per ascolrare musica come uno cassa e comodo anche la possibilit  di chiamare l eco dot e di chiamare il telefono da esso capita molto spesso che lascio il telefono in giro per casa e non lo trovo,"4,0",0.186,Good
ottimo,ottimo prodotto arrivato nei tempi previsti senza alcun danno ,"5,0",0.25,Good
certezza amazon,   eco che acquisto    connesse tutte le camere di casa mia  insieme alle lampadine e alle prese intelligenti  essenziali per rendere smart la propria casa,"5,0",0.069,Good
echo dot    generazione,qualit  del suono uguale all echo dot classico        nulla di superiore solo il prezzo   configurazione e comandi classici     personalmente penso non valga la pena  se la differenza   solo la forma ,"4,0",0.25,Good
finalmente alexa ,finalmente anche io sono entrato nel mondo magico di alexa  sono contento perch  ora posso cominciare a esplorare il mondo dell intelligenza artificiale e della domotica  un passo alla volra,"5,0",0.25,Good
buono,mi sembrava pi  grosso dalla foto  del resto fa quello per cui   programmato ,"4,0",0.25,Good
preferivo il modello cilindrico,ottimo prodotto  ma il suono   pi  scadente rispetto al modello cilindrico del     ,"4,0",0.25,Good
funziona,x avere alexa sempre pronta  solo uno sfizio ma ormai la tengo,"5,0",0.25,Good
utile,  un valido aiuto per la casa,"5,0",0.25,Good
si pu  migliorare,adoro la tecnologia e mi piace molto usare alexa x sveglie  timer  musica ecc   il problema   che spesso non sa rispondere a delle cose che le si chiede  esempio  eliminare una canzone dalla mia playlist   non riesce a farlo  bisogna lavorare sull  interazione  ,"3,0",-0.1457,Bad
ottimo,una amica sul comodino   l ha amo,"5,0",0.186,Good
alexia,molto utile x me  perch  come al solito dimentico tutto  e alexia mi aiuta tantissimo  il prodotto   ottimo,"5,0",0.25,Good
bene ,audio discreto a patto di non alzare molto il volume  esteticamente accattivante   ha un sensore di temperatura che   chiedendo  informa sui gradi  della stanza in cui e  collocato  senza abbonamento premium si ascoltano i brani casuali  e non quelli voluti ,"5,0",0.186,Good
ottimo ma non   ben spiegato    incasinato nell usarlo la prima volta,ottimo ma non   ben spiegato    incasinato nell usarlo la prima volta,"4,0",0.25,Good
bel sistema ,facilit  d installazione  difficolt  a riconoscere altri apparati blutooth ,"4,0",0.25,Good
favolosi,che dire sono piccoli ma hanno un audio fantastico messo in paragone con echo dot gen o echo dot  gen  inoltre con i sensori di movimento e temperatura   l ottimo prezzo fanno il resto  si possono creare molte routine  per fortuna i microfoni sono sensibili e non bisogna gridare come matti   senza fare nomi echo show    lo consiglio mi piace moltissimo,"4,0",-0.1027,Bad
finalmente  questi funzionano bene e si sentono meglio,ne avevo due di quarta generazione e funzionavano male  audio che gracchiava in home theater con firestick  il bello era che con i due di terza generazione tutto funzionava bene  ora ho preso questa coppia di quinta generazione e tutto funziona bene di nuovo  quelli di quarta non andavano bene  problemi di audio gracchiante  inoltre  questi di quinta hanno pure il sensore di temperatura  lasciate perdere quelli di quarta  terza generazione per risparmiare  quinta per avere qualcosa in pi  sull audio ed il sensore di temperatura ,"5,0",0.25,Good
cambia la tua vita con alexa ,ho comprato questo echo dot durante il black friday dato lo sconto  ed   incredibile quanto si sia integrato facilmente nella mia quotidianit  comodo poter spegnere ed accendere luci con i comandi vocali  ricevere informazioni o semplicemente fare una chiacchierata con le svariate possibilit  che offre alexa unica pecca   il filo bianco che viene fornito con la colorazione antracite  che per chi come me ha delle manie di perfezionismo si ritrova a comprarne uno di colore nero a parte ,"5,0",0.0706,Good
